354,"Cristiano Ronaldo and Lionel Messi are the two best players of this generation. Their rivalry was at its fiercest during El Clasicos in La Liga, but the bitter aftertaste lingers to this day.",5 reasons why Lionel Messi is disliked by some people,"5 reasons why Lionel Messi is disliked by some people.Cristiano Ronaldo and Lionel Messi are the two best players of this generation. Their rivalry was at its fiercest during El Clasicos in La Liga, but the bitter aftertaste lingers to this day."
355,"Argentina closed in on a direct World Cup spot on Friday with a 1-0 win at Uruguay, despite the absence of Lionel Messi for most of the match as he recovers from a left knee injury. Veteran winger Ángel di María scored the only goal in the seventh minute with a powerful left foot shot from the right corner of the penalty box.",Argentina wins 1-0 at Uruguay without Messi as a starter,"Argentina wins 1-0 at Uruguay without Messi as a starter.Argentina closed in on a direct World Cup spot on Friday with a 1-0 win at Uruguay, despite the absence of Lionel Messi for most of the match as he recovers from a left knee injury. Veteran winger Ángel di María scored the only goal in the seventh minute with a powerful left foot shot from the right corner of the penalty box."
356,"Argentina closed in on a direct World Cup spot on Friday with a 1-0 win at Uruguay, despite the absence of Lionel Messi for most of the match as he recovers from a left knee injury.",World Cup Qualifiers: Argentina wins 1-0 at Uruguay without Messi as a starter,"World Cup Qualifiers: Argentina wins 1-0 at Uruguay without Messi as a starter.Argentina closed in on a direct World Cup spot on Friday with a 1-0 win at Uruguay, despite the absence of Lionel Messi for most of the match as he recovers from a left knee injury."
357,"In a highly anticipated matchup for Matchday 13 of the South American 2022 World Cup Qualifiers, Uruguay host Argentina today, Friday, November 12. Unfortunately, Lionel Messi will not start for the visitors.",Uruguay vs Argentina: Why is Lionel Messi not starting in the World Cup Qualifier game?,"Uruguay vs Argentina: Why is Lionel Messi not starting in the World Cup Qualifier game?.In a highly anticipated matchup for Matchday 13 of the South American 2022 World Cup Qualifiers, Uruguay host Argentina today, Friday, November 12. Unfortunately, Lionel Messi will not start for the visitors."
358,"Paris Saint-Germain boss Mauricio Pochettino has revealed what it is like to work with the superstar trio of Lionel Messi, Kylian Mbappe and Neymar amid their stuttering start to the campaign.",Poch opens up on managing Messi & co.,"Poch opens up on managing Messi & co..Paris Saint-Germain boss Mauricio Pochettino has revealed what it is like to work with the superstar trio of Lionel Messi, Kylian Mbappe and Neymar amid their stuttering start to the campaign."
359,"Ramos has not played a single match for PSG since joining the club this summer from Spanish giants. Incidentally, just a few days after Ramos made the move, Barcelona announced that they won't be able to renew Messi's contract.","Are Messi, Ramos struggling to put past rivalry behind them?","Are Messi, Ramos struggling to put past rivalry behind them?.Ramos has not played a single match for PSG since joining the club this summer from Spanish giants. Incidentally, just a few days after Ramos made the move, Barcelona announced that they won't be able to renew Messi's contract."
360,"Ramos has not played a single match for PSG since joining the club this summer from Spanish giants. Incidentally, just a few days after Ramos made the move, Barcelona announced that they won't be able to renew Messi's contract.","Are Messi, Ramos struggling to put past rivalry behind them?","Are Messi, Ramos struggling to put past rivalry behind them?.Ramos has not played a single match for PSG since joining the club this summer from Spanish giants. Incidentally, just a few days after Ramos made the move, Barcelona announced that they won't be able to renew Messi's contract."
361,"Undoubtedly, the emergence of Lionel Messi at Barcelona almost two decades ago wholly altered the history of football forever.",5 rival managers who publicly praised Lionel Messi,"5 rival managers who publicly praised Lionel Messi.Undoubtedly, the emergence of Lionel Messi at Barcelona almost two decades ago wholly altered the history of football forever."
362,"Nothing worth having ever comes easy, and the stories of so many GOATs seem to reflect that: from Federer to Hamilton and so many more, including one Lionel Messi, the s1mple of world football. In terms of fame,",There can be no more debate about who the GOAT is: The s1mple and Messi parallels,"There can be no more debate about who the GOAT is: The s1mple and Messi parallels.Nothing worth having ever comes easy, and the stories of so many GOATs seem to reflect that: from Federer to Hamilton and so many more, including one Lionel Messi, the s1mple of world football. In terms of fame,"
363,"Paris Saint-Germain manager Mauricio Pochettino said that he ""cannot"" teach Lionel Messi, Kylian Mbappe, and Neymar Jr due to their talent. He added that the trio need time ""to start creating this type of link.","You cannot teach Messi, Neymar & Mbappe: PSG's manager Pochettino","You cannot teach Messi, Neymar & Mbappe: PSG's manager Pochettino.Paris Saint-Germain manager Mauricio Pochettino said that he ""cannot"" teach Lionel Messi, Kylian Mbappe, and Neymar Jr due to their talent. He added that the trio need time ""to start creating this type of link."
364,"When it comes to the topic of the greatest footballers in history, the names of Lionel Messi and Cristiano Ronaldo would undoubtedly rate among the top two, with the likes of Pele, Diego Maradona and a few others also rightfully in the conversation.",What would Lionel Messi’s stats be if he played as many games as Cristiano Ronaldo have?,"What would Lionel Messi’s stats be if he played as many games as Cristiano Ronaldo have?.When it comes to the topic of the greatest footballers in history, the names of Lionel Messi and Cristiano Ronaldo would undoubtedly rate among the top two, with the likes of Pele, Diego Maradona and a few others also rightfully in the conversation."
365,"FC Barcelona saw Lionel Messi leave for Paris Saint-Germain over the summer, but it only has to wait a few more years to replace him. During a youth academy match, a 7-year-old scored on one of the greatest runs that you will ever see on any level.",7-Year-Old FC Barcelona ‘Wonderkid’ Scores Unbelievable Goal That Draws Leo Messi Comparison,"7-Year-Old FC Barcelona ‘Wonderkid’ Scores Unbelievable Goal That Draws Leo Messi Comparison.FC Barcelona saw Lionel Messi leave for Paris Saint-Germain over the summer, but it only has to wait a few more years to replace him. During a youth academy match, a 7-year-old scored on one of the greatest runs that you will ever see on any level."
366,Lionel Messi is running the risk of infuriating his new employers Paris Saint-Germain after being declared fit to play for Argentina – despite missing the last two matches of the Ligue 1 giants due to ‘knee and hamstring pains.,PSG furious as Lionel Messi is declared fit to face Uruguay,PSG furious as Lionel Messi is declared fit to face Uruguay.Lionel Messi is running the risk of infuriating his new employers Paris Saint-Germain after being declared fit to play for Argentina – despite missing the last two matches of the Ligue 1 giants due to ‘knee and hamstring pains.
367,"Lionel Messi will be available for Argentina's 2022 World Cup qualifiers against Uruguay and Brazil after recovering from hamstring and knee problems, Albiceleste manager Lionel Scaloni has said.","Messi fit for Argentina World Cup qualifiers against Uruguay, Brazil","Messi fit for Argentina World Cup qualifiers against Uruguay, Brazil.Lionel Messi will be available for Argentina's 2022 World Cup qualifiers against Uruguay and Brazil after recovering from hamstring and knee problems, Albiceleste manager Lionel Scaloni has said."
368,Messi is running the risk of infuriating his new employers PSG after being declared fit to play for Argentina - despite missing the last two matches due to 'knee and hamstring pains.',PSG left furious as Lionel Messi is declared fit to face Uruguay by Argentina despite superstar missing the last two matches for the French giants... but national boss Scaloni ...,PSG left furious as Lionel Messi is declared fit to face Uruguay by Argentina despite superstar missing the last two matches for the French giants... but national boss Scaloni ....Messi is running the risk of infuriating his new employers PSG after being declared fit to play for Argentina - despite missing the last two matches due to 'knee and hamstring pains.'
369,Lionel Messi joined Paris Saint-Germain on a two-year contract from Barcelona this summer but his previous admission that he wants to play alongside Cristiano Ronaldo may hint at his future,Lionel Messi's 2015 Cristiano Ronaldo admission could help Man Utd in transfer market,Lionel Messi's 2015 Cristiano Ronaldo admission could help Man Utd in transfer market.Lionel Messi joined Paris Saint-Germain on a two-year contract from Barcelona this summer but his previous admission that he wants to play alongside Cristiano Ronaldo may hint at his future
370,Lionel Messi is due to play for Argentina against Uruguay and Brazil despite missing PSG's previous two games in Ligue 1 and the Champions League,PSG Angry After Lionel Messi Is Cleared Fit For Argentina's World Cup Qualifiers,PSG Angry After Lionel Messi Is Cleared Fit For Argentina's World Cup Qualifiers.Lionel Messi is due to play for Argentina against Uruguay and Brazil despite missing PSG's previous two games in Ligue 1 and the Champions League
371,Argentina boss Lionel Scaloni has said that Lionel Messi is fit for his national team's key World Cup 2022 qualification clash with Uruguay. The 34-year-old has recently been unav,Lionel Messi declared fit for Argentina's clash with Uruguay,Lionel Messi declared fit for Argentina's clash with Uruguay.Argentina boss Lionel Scaloni has said that Lionel Messi is fit for his national team's key World Cup 2022 qualification clash with Uruguay. The 34-year-old has recently been unav
372,ARGENTINA boss Lionel Scaloni has defended his decision to call-up Lionel Messi for their upcoming World Cup qualifiers. The 34-year-old forward missed Paris Saint-Germain’s last two games,Lionel Messi decision to play for Argentina defended by boss Lionel Scaloni with PSG fuming over his call-up,Lionel Messi decision to play for Argentina defended by boss Lionel Scaloni with PSG fuming over his call-up.ARGENTINA boss Lionel Scaloni has defended his decision to call-up Lionel Messi for their upcoming World Cup qualifiers. The 34-year-old forward missed Paris Saint-Germain’s last two games
373,"Since joining Paris Saint-Germain back on August 10, Lionel Messi has scored more times for Argentina than with his new team following his departure from Barcelona. The Argentine",Messi's numbers reflect commitment to Argentina over PSG,"Messi's numbers reflect commitment to Argentina over PSG.Since joining Paris Saint-Germain back on August 10, Lionel Messi has scored more times for Argentina than with his new team following his departure from Barcelona. The Argentine"
374,"Argentina manager Lionel Scaloni has defended his decision to call-up Lionel Messi for their upcoming World Cup qualifiers, despite PSG's opposition.",Argentina boss insists they are 'within their rights' to call up Messi despite PSG anger,"Argentina boss insists they are 'within their rights' to call up Messi despite PSG anger.Argentina manager Lionel Scaloni has defended his decision to call-up Lionel Messi for their upcoming World Cup qualifiers, despite PSG's opposition."
375,PSG may have only just signed Lionel Messi - but Xavi becoming manager at Barcelona puts a return back on the cards,"Barcelona WILL lure back Lionel Messi: Xavi is the key factor to re-sign PSG star, according to reports","Barcelona WILL lure back Lionel Messi: Xavi is the key factor to re-sign PSG star, according to reports.PSG may have only just signed Lionel Messi - but Xavi becoming manager at Barcelona puts a return back on the cards"
376,"Read: Decision Made On Messi Amid PSG's Anger. PSG director Leonardo was not happy with the 2021 Copa America champions' decision to call up Messi, who had missed theclub's latest",Argentina Coach Hits Back At PSG After Messi Drama,"Argentina Coach Hits Back At PSG After Messi Drama.Read: Decision Made On Messi Amid PSG's Anger. PSG director Leonardo was not happy with the 2021 Copa America champions' decision to call up Messi, who had missed theclub's latest"
377,Hlompho Kekana played alongside Percy Tau under Pitso Mosimane and even got to meet the legendary Lionel Messi!,"Hlompho Kekana’s LEGENDARY encounters with Lionel Messi, Percy Tau and Pitso Mosimane – PICTURES","Hlompho Kekana’s LEGENDARY encounters with Lionel Messi, Percy Tau and Pitso Mosimane – PICTURES.Hlompho Kekana played alongside Percy Tau under Pitso Mosimane and even got to meet the legendary Lionel Messi!"
378,AC Milan welcomed back new signing Junior Messias to training after an extended period out with a muscle injury. The Brazilian attacker has featured only once for Milan since his arrival this summer from Crotone.,AC Milan’s 30 Year Old Attacker Returns To Training After Muscle Injury,AC Milan’s 30 Year Old Attacker Returns To Training After Muscle Injury.AC Milan welcomed back new signing Junior Messias to training after an extended period out with a muscle injury. The Brazilian attacker has featured only once for Milan since his arrival this summer from Crotone.
379,Lionel Messi is set to play for Argentina against Uruguay in this week's World Cup qualifier despite his club side Paris Saint-Germain claiming he was not fit to play,Lionel Messi sparks PSG clash as concerns over his fitness emerge,Lionel Messi sparks PSG clash as concerns over his fitness emerge.Lionel Messi is set to play for Argentina against Uruguay in this week's World Cup qualifier despite his club side Paris Saint-Germain claiming he was not fit to play
380,PSG are hoping Lionel Messi can regain his scintillating form after the international break. The Argentinean has failed to impress in Ligue 1 since joining the Parisians this summer.,Mauricio Pochettino happy with Lionel Messi's form for PSG,Mauricio Pochettino happy with Lionel Messi's form for PSG.PSG are hoping Lionel Messi can regain his scintillating form after the international break. The Argentinean has failed to impress in Ligue 1 since joining the Parisians this summer.
381,PSG are hoping Lionel Messi can regain his scintillating form after the international break. The Argentinean has failed to impress in Ligue 1 since joining the Parisians this summer.,Mauricio Pochettino happy with Lionel Messi's form for PSG,Mauricio Pochettino happy with Lionel Messi's form for PSG.PSG are hoping Lionel Messi can regain his scintillating form after the international break. The Argentinean has failed to impress in Ligue 1 since joining the Parisians this summer.
382,Paris Saint-Germain bigwigs are fuming over the international football rules which have robbed them of star signing Lionel Messi and his Argentina teammate Leandro Paredes much to the glee of the country's media.,Getting Messi: PSG chiefs rail over call-up for injured Argentine stars,Getting Messi: PSG chiefs rail over call-up for injured Argentine stars.Paris Saint-Germain bigwigs are fuming over the international football rules which have robbed them of star signing Lionel Messi and his Argentina teammate Leandro Paredes much to the glee of the country's media.
383,"Lionel Messi has had a slow start to his PSG career, having failed to reach his normal level since joining the Parisians in the summer transfer window.","“He is very good, and he adapted very well"" - Mauricio Pochettino on what he's seen from Lionel Messi at PSG","“He is very good, and he adapted very well"" - Mauricio Pochettino on what he's seen from Lionel Messi at PSG.Lionel Messi has had a slow start to his PSG career, having failed to reach his normal level since joining the Parisians in the summer transfer window."
384,"Having Lionel Messi, Kylian Mbappe and Neymar in the same team is a laudable achievement for Paris Saint-Germain.","""You cannot teach these great players"" - PSG boss Mauricio Pochettino on managing Lionel Messi, Neymar and Kylian Mbappe","""You cannot teach these great players"" - PSG boss Mauricio Pochettino on managing Lionel Messi, Neymar and Kylian Mbappe.Having Lionel Messi, Kylian Mbappe and Neymar in the same team is a laudable achievement for Paris Saint-Germain."
385,Get latest Lionel Messi Fitness news updates & stories. Explore Lionel Messi Fitness photos and videos on India.com,Lionel Messi Fitness,Lionel Messi Fitness.Get latest Lionel Messi Fitness news updates & stories. Explore Lionel Messi Fitness photos and videos on India.com
386,"Copa64 won three categories at The Drum Awards for Social Media in 2021, taking home ‘Travel, Leisure or Sports’, ‘Best Influencer Campaign’ and ‘Best Viral Campaign’. Its work for Anheuser-Busch InBev celebrated a record-setting goal from Lionel Messi,","644 goals, 644 bottles, 1 iconic moment: how Budweiser & Copa64 celebrated Messi's record","644 goals, 644 bottles, 1 iconic moment: how Budweiser & Copa64 celebrated Messi's record.Copa64 won three categories at The Drum Awards for Social Media in 2021, taking home ‘Travel, Leisure or Sports’, ‘Best Influencer Campaign’ and ‘Best Viral Campaign’. Its work for Anheuser-Busch InBev celebrated a record-setting goal from Lionel Messi,"
387,Lionel Messi has made no secret of the fact that leading Argentina to the World Cup in a year's time is his top priority.,"A message to PSG: Argentina, not club football, is Messi's motivator","A message to PSG: Argentina, not club football, is Messi's motivator.Lionel Messi has made no secret of the fact that leading Argentina to the World Cup in a year's time is his top priority."
388,BUENOS AIRES  - Argentina's Lionel Messi has recovered from the knee and hamstring worries that kept him out of Paris St Germain,Qatar - Messi fit to face Uruguay in World Cup qualifier,Qatar - Messi fit to face Uruguay in World Cup qualifier.BUENOS AIRES  - Argentina's Lionel Messi has recovered from the knee and hamstring worries that kept him out of Paris St Germain
389,"Argentina head coach, Lionel Scaloni has hit back at Paris Saint-Germain and opened up on his reason for calling up the country's talisman, Lionel Messi to the",'We are well within our rights to call Lionel Messi up' - Argentina coach responds to PSG criticism,"'We are well within our rights to call Lionel Messi up' - Argentina coach responds to PSG criticism.Argentina head coach, Lionel Scaloni has hit back at Paris Saint-Germain and opened up on his reason for calling up the country's talisman, Lionel Messi to the"
390,"Argentina midfielder Alejandro 'Papu' Gomez has revealed that it is ""a gift"" to play alongside compatriot and Albiceleste skipper Lionel Messi.",“It’s a gift” – Argentina star who wants to “help” Lionel Messi win the World Cup opens up on playing with the “main man”,"“It’s a gift” – Argentina star who wants to “help” Lionel Messi win the World Cup opens up on playing with the “main man”.Argentina midfielder Alejandro 'Papu' Gomez has revealed that it is ""a gift"" to play alongside compatriot and Albiceleste skipper Lionel Messi."
391,Argentina coach Lionel Scaloni said staff had worked separately with the 34-year-old Messi to prepare him for clashed against Uruguay and Brazil.,Messi fit to face Uruguay in World Cup Qualifiers,Messi fit to face Uruguay in World Cup Qualifiers.Argentina coach Lionel Scaloni said staff had worked separately with the 34-year-old Messi to prepare him for clashed against Uruguay and Brazil.
392,"Argentina superstar Lionel Messi is set to make his return from injury in a World Cup qualifier against Uruguay, his coach Lionel Scaloni said on Thursday. The six-time Ballon dOr",World Cup Qualifiers: Lionel Messi Set to Play Against Uruguay After Injury,"World Cup Qualifiers: Lionel Messi Set to Play Against Uruguay After Injury.Argentina superstar Lionel Messi is set to make his return from injury in a World Cup qualifier against Uruguay, his coach Lionel Scaloni said on Thursday. The six-time Ballon dOr"
393,"A new trailer has arrived for “Being the Ricardos,” giving fans their first complete look at Nicole Kidman’s portrayal of comedy icon Lucille Ball, voice and all. And fans are still convinced that Debra Messing should’ve been cast in the role instead.",Lucille Ball Fans Still Upset Over Nicole Kidman Casting in ‘Being the Ricardos': ‘Debra Messing Was Robbed’,"Lucille Ball Fans Still Upset Over Nicole Kidman Casting in ‘Being the Ricardos': ‘Debra Messing Was Robbed’.A new trailer has arrived for “Being the Ricardos,” giving fans their first complete look at Nicole Kidman’s portrayal of comedy icon Lucille Ball, voice and all. And fans are still convinced that Debra Messing should’ve been cast in the role instead."
394,"Argentina are anxiously waiting on the fitness of Lionel Messi ahead of their World Cup qualifiers - despite their star player taking part in training. A knee injury has kept him out of two matches for his club Paris Saint-Germain,",Lionel Messi works out with Argentina stars despite injury fears - in pictures,"Lionel Messi works out with Argentina stars despite injury fears - in pictures.Argentina are anxiously waiting on the fitness of Lionel Messi ahead of their World Cup qualifiers - despite their star player taking part in training. A knee injury has kept him out of two matches for his club Paris Saint-Germain,"
395,Paris Saint-Germain had the most eye-catching summer of any club with the arrivals of multiple star players including Lionel Messi and Sergio Ramos with their wages now reported,PSG's astronomical wage bill revealed as Lionel Messi makes more money than Sergio Ramos,PSG's astronomical wage bill revealed as Lionel Messi makes more money than Sergio Ramos.Paris Saint-Germain had the most eye-catching summer of any club with the arrivals of multiple star players including Lionel Messi and Sergio Ramos with their wages now reported
396,"Lionel Messi has endured a difficult start to his Paris Saint-Germain career, failing to score a single league goal in his first three months in the French capital",Lionel Messi 'disobeying' PSG as exit claims and Sergio Ramos relationship come to light,"Lionel Messi 'disobeying' PSG as exit claims and Sergio Ramos relationship come to light.Lionel Messi has endured a difficult start to his Paris Saint-Germain career, failing to score a single league goal in his first three months in the French capital"
397,"Lionel Messi has endured a difficult start to his Paris Saint-Germain career, failing to score a single league goal in his first three months in the French capital",Lionel Messi 'disobeying' PSG as exit claims and Sergio Ramos relationship come to light,"Lionel Messi 'disobeying' PSG as exit claims and Sergio Ramos relationship come to light.Lionel Messi has endured a difficult start to his Paris Saint-Germain career, failing to score a single league goal in his first three months in the French capital"
398,Being the Ricardos” dropped a new trailer on Wednesday that got fans talking — and Messing devotees grumbling.,Debra Messing fans still mad Nicole Kidman is playing Lucille Ball in biopic,Debra Messing fans still mad Nicole Kidman is playing Lucille Ball in biopic.Being the Ricardos” dropped a new trailer on Wednesday that got fans talking — and Messing devotees grumbling.
399,"Argentina superstar Lionel Messi is set to make his return from injury in a World Cup qualifier against Uruguay, his coach Lionel Scaloni said yesterday.",Messi set to play against Uruguay,"Messi set to play against Uruguay.Argentina superstar Lionel Messi is set to make his return from injury in a World Cup qualifier against Uruguay, his coach Lionel Scaloni said yesterday."
400,Newell's Old Boys shared an exclusive video of what is believed to be Lionel Messi's first-ever post-match interview. The legendary Argentine was just 13 at th,Newell's Old Boys share video of Lionel Messi's first post-match interview,Newell's Old Boys share video of Lionel Messi's first post-match interview.Newell's Old Boys shared an exclusive video of what is believed to be Lionel Messi's first-ever post-match interview. The legendary Argentine was just 13 at th
401,"Sergio Ramos and Lionel Messi are still not on the best of terms despite linking up at Paris Saint-Germain. For years, the pair had a heated rivalry in El Clasico - playing against each other a staggering 45 times and always seeming to butt heads.",Worrying Reports Emerge Regarding Sergio Ramos And Lionel Messi's Relationship At Paris Saint-Germain,"Worrying Reports Emerge Regarding Sergio Ramos And Lionel Messi's Relationship At Paris Saint-Germain.Sergio Ramos and Lionel Messi are still not on the best of terms despite linking up at Paris Saint-Germain. For years, the pair had a heated rivalry in El Clasico - playing against each other a staggering 45 times and always seeming to butt heads."
