1,"Lionel Messi has never played in the Premier League – but has still managed to embarrass England’s finest on a regular basis during his glittering career.  Despite winning seven Ballons d’Or in his career,",Watch: Lionel Messi humiliating PL ‘Big Six’ opponents with nutmegs,"Watch: Lionel Messi humiliating PL ‘Big Six’ opponents with nutmegs.Lionel Messi has never played in the Premier League – but has still managed to embarrass England’s finest on a regular basis during his glittering career.  Despite winning seven Ballons d’Or in his career,"
2,"Lionel Messi is arguably one of the greatest players to grace the game. His technique, poise, skill and understanding of the game benefitted Barcelona for the longest time and is now proving to be vital for Paris Saint-Germain.",5 players who received most number of assists from Lionel Messi,"5 players who received most number of assists from Lionel Messi.Lionel Messi is arguably one of the greatest players to grace the game. His technique, poise, skill and understanding of the game benefitted Barcelona for the longest time and is now proving to be vital for Paris Saint-Germain."
3,"Lionel Messi, Cristiano Ronaldo and Diego Maradona are just three of the players who are amongst the conversation for the greatest male footballer in history. Everybody has their own two cents to offer on the GOAT debate and seldom does a day go by where at least one corner of social media isn't going back and forth about their selections.","Ronaldo, Messi, Ronaldinho, Zidane: Football's greatest ever male XI as voted for by fans","Ronaldo, Messi, Ronaldinho, Zidane: Football's greatest ever male XI as voted for by fans.Lionel Messi, Cristiano Ronaldo and Diego Maradona are just three of the players who are amongst the conversation for the greatest male footballer in history. Everybody has their own two cents to offer on the GOAT debate and seldom does a day go by where at least one corner of social media isn't going back and forth about their selections."
4,"In keeping with tradition, Lionel Messi is once again nominated in the final three of The Best FIFA Men’s Player awards. FIFA will probably keep nominating him when he retires. Messi is up against Bayern Munich and Poland striker Robert Lewandowski and Liverpool and Egypt superstar Mo Salah.",FIFA’s Best: Messi makes final three with Lewandowski and Salah,"FIFA’s Best: Messi makes final three with Lewandowski and Salah.In keeping with tradition, Lionel Messi is once again nominated in the final three of The Best FIFA Men’s Player awards. FIFA will probably keep nominating him when he retires. Messi is up against Bayern Munich and Poland striker Robert Lewandowski and Liverpool and Egypt superstar Mo Salah."
5,<p>Lionel Messi<br></p>,Lionel Messi,Lionel Messi.<p>Lionel Messi<br></p>
6,Paris Saint-Germain have reportedly been surprised by Lionel Messi's behaviour in his first few months with the club.,PSG 'surprised' by Messi's behaviour,PSG 'surprised' by Messi's behaviour.Paris Saint-Germain have reportedly been surprised by Lionel Messi's behaviour in his first few months with the club.
7,"Lionel Messi was pictured at numerous parties back home in Argentina over Christmas and ultimately contracted a Covid-19 infection, the effects of which could yet rule him out of Sunday’s Ligue 1 clas",How Messi became the latest superstar dragged into PSG's 'player power' row,"How Messi became the latest superstar dragged into PSG's 'player power' row.Lionel Messi was pictured at numerous parties back home in Argentina over Christmas and ultimately contracted a Covid-19 infection, the effects of which could yet rule him out of Sunday’s Ligue 1 clas"
8,Paris Saint-Germain (PSG) will be without Lionel Messi for the Ligue 1 clash against Lyon at the Parc Olympique Lyonnais.,Is Lionel Messi playing for PSG against Lyon tonight?,Is Lionel Messi playing for PSG against Lyon tonight?.Paris Saint-Germain (PSG) will be without Lionel Messi for the Ligue 1 clash against Lyon at the Parc Olympique Lyonnais.
9,"After a scintillating 2021 at Liverpool, Mohamed Salah has made the three-man final shortlist for the highly-coveted Best FIFA Men’s Player of the Year award alongside Lionel Messi and Robert Lewandowski.",Mo Salah Makes Three-Man Shortlist for FIFA Men’s Best Player Award,"Mo Salah Makes Three-Man Shortlist for FIFA Men’s Best Player Award.After a scintillating 2021 at Liverpool, Mohamed Salah has made the three-man final shortlist for the highly-coveted Best FIFA Men’s Player of the Year award alongside Lionel Messi and Robert Lewandowski."
10,"Just released this morning is that FC Bayern’s Robert Lewandowski is a finalist for UEFA’s “The Best” for the second straight year, joined by PSG’s Lionel Messi & Liverpool’s Mo Salah","Robert Lewandowski, Lionel Messi, Mohammad Salah are the finalists for FIFA’s “The Best” award","Robert Lewandowski, Lionel Messi, Mohammad Salah are the finalists for FIFA’s “The Best” award.Just released this morning is that FC Bayern’s Robert Lewandowski is a finalist for UEFA’s “The Best” for the second straight year, joined by PSG’s Lionel Messi & Liverpool’s Mo Salah"
11,Paris St Germain will be without Lionel Messi for their Ligue 1 trip to Lyon as he continues his recovery following a positive COVID-19 test. Messi tested,Messi to miss PSG match against Lyon,Messi to miss PSG match against Lyon.Paris St Germain will be without Lionel Messi for their Ligue 1 trip to Lyon as he continues his recovery following a positive COVID-19 test. Messi tested
12,"Nabil Trabelsi, Gernot Rohr’s assistant has tagged Super Eagles winger, Samuel Chukwueze as Africa’s Lionel Messi. Trabelsi stated this in an interview with Filgoal, where he said that Chukwueze’s possesses the the right quality to take the Super Eagles far in Cameroon.",AFCON 2021: Chukwueze’s Africa’s Lionel Messi –Trabelsi,"AFCON 2021: Chukwueze’s Africa’s Lionel Messi –Trabelsi.Nabil Trabelsi, Gernot Rohr’s assistant has tagged Super Eagles winger, Samuel Chukwueze as Africa’s Lionel Messi. Trabelsi stated this in an interview with Filgoal, where he said that Chukwueze’s possesses the the right quality to take the Super Eagles far in Cameroon."
13,FRANCE Runaway league leader Paris Saint-Germain will be without Lionel Messi and several other players who had the coronavirus for the trip to face Lyon.,"MATCHDAY: PSG without Messi, Klopp back in Liverpool dugout","MATCHDAY: PSG without Messi, Klopp back in Liverpool dugout.FRANCE Runaway league leader Paris Saint-Germain will be without Lionel Messi and several other players who had the coronavirus for the trip to face Lyon."
14,"Robert Lewandowski, Lionel Messi, and Mohamed Salah were named on Friday as the three finalists for the Fifa Best Men's Player award, while Ballon d'Or winner Alexia Putellas was nominated for the women's prize.","Lewandowski, Messi and Salah finalists for Fifa Best award","Lewandowski, Messi and Salah finalists for Fifa Best award.Robert Lewandowski, Lionel Messi, and Mohamed Salah were named on Friday as the three finalists for the Fifa Best Men's Player award, while Ballon d'Or winner Alexia Putellas was nominated for the women's prize."
15,"PSG forward Lionel Messi tests negative for COVID-19, returns to Paris - Seven-times Ballon d'Or winner Lionel Messi missed PSG's 4-0 win away to third-tier club Vannes on Monday in a French Cup round-of-32 match.","PSG forward Lionel Messi tests negative for COVID-19, returns to Paris","PSG forward Lionel Messi tests negative for COVID-19, returns to Paris.PSG forward Lionel Messi tests negative for COVID-19, returns to Paris - Seven-times Ballon d'Or winner Lionel Messi missed PSG's 4-0 win away to third-tier club Vannes on Monday in a French Cup round-of-32 match."
16,"PSG forward Lionel Messi tests negative for COVID-19, returns to Paris - Seven-times Ballon d'Or winner Lionel Messi missed PSG's 4-0 win away to third-tier club Vannes on Monday in a French Cup round-of-32 match.","PSG forward Lionel Messi tests negative for COVID-19, returns to Paris","PSG forward Lionel Messi tests negative for COVID-19, returns to Paris.PSG forward Lionel Messi tests negative for COVID-19, returns to Paris - Seven-times Ballon d'Or winner Lionel Messi missed PSG's 4-0 win away to third-tier club Vannes on Monday in a French Cup round-of-32 match."
17,"Germain’s Argentinian forward Lionel Messi leaves the pitch after chatting with head coach Mauricio Pochettino during the French L1 football match between Paris-Saint Germain (PSG) and Olympique Lyonnais at The Parc des Princes Stadium in Paris on September 19,",Lionel Messi Covid update ahead of PSG’s clash with Lyon,"Lionel Messi Covid update ahead of PSG’s clash with Lyon.Germain’s Argentinian forward Lionel Messi leaves the pitch after chatting with head coach Mauricio Pochettino during the French L1 football match between Paris-Saint Germain (PSG) and Olympique Lyonnais at The Parc des Princes Stadium in Paris on September 19,"
18,Get latest Lionel Messi Paris news updates & stories. Explore Lionel Messi Paris photos and videos on India.com,lionel messi paris,lionel messi paris.Get latest Lionel Messi Paris news updates & stories. Explore Lionel Messi Paris photos and videos on India.com
19,Argentina international Lionel Messi joined PSG from boyhood club Barcelona in August and has scored six goals in 16 games in all competitions for the Parisian side.,Lionel Messi returns to Paris after negative COVID-19 test to join PSG,Lionel Messi returns to Paris after negative COVID-19 test to join PSG.Argentina international Lionel Messi joined PSG from boyhood club Barcelona in August and has scored six goals in 16 games in all competitions for the Parisian side.
20,Messi was among the four PSG players who returned positive results on Sunday. The 34-year-old had been in Argentina at the time of his result.,Lionel Messi returns to Paris after negative Covid test,Lionel Messi returns to Paris after negative Covid test.Messi was among the four PSG players who returned positive results on Sunday. The 34-year-old had been in Argentina at the time of his result.
21,"Lionel Messi has tested negative for COVID-19 and already returned to Paris and will be back in training with the team in the coming days, Paris Saint-Germain confirmed on Wednesday. The seven-time Ballon d'Or winner was contaminated by the virus last week in Argentina,",Messi returns to PSG after negative COVID-19 test,"Messi returns to PSG after negative COVID-19 test.Lionel Messi has tested negative for COVID-19 and already returned to Paris and will be back in training with the team in the coming days, Paris Saint-Germain confirmed on Wednesday. The seven-time Ballon d'Or winner was contaminated by the virus last week in Argentina,"
22,"PARIS - Lionel Messi has tested negative for COVID-19 and already returned to Paris and will be back in training with the team in the coming days, Paris Saint-Germain confirmed on Wednesday. The seven-time Ballon d'Or winner was contaminated by the virus last week in Argentina,","Messi tests negative for COVID-19, already back in Paris","Messi tests negative for COVID-19, already back in Paris.PARIS - Lionel Messi has tested negative for COVID-19 and already returned to Paris and will be back in training with the team in the coming days, Paris Saint-Germain confirmed on Wednesday. The seven-time Ballon d'Or winner was contaminated by the virus last week in Argentina,"
23,Liverpool's Mohamed Salah and Trent Alexander-Arnold have been named in L'Equipe's world team of the year but there was no place for Lionel Messi,Two Liverpool players named in L'Equipe team of year as Lionel Messi overlooked,Two Liverpool players named in L'Equipe team of year as Lionel Messi overlooked.Liverpool's Mohamed Salah and Trent Alexander-Arnold have been named in L'Equipe's world team of the year but there was no place for Lionel Messi
24,"Messi, 34, won Copa America with his country last summer, as well as leading Barcelona to victory in the Copa del Rey before leaving for the French capital before the start of the new campaign.",Lionel Messi AND Cristiano Ronaldo are snubbed in L'Equipe's Team of 2021,"Lionel Messi AND Cristiano Ronaldo are snubbed in L'Equipe's Team of 2021.Messi, 34, won Copa America with his country last summer, as well as leading Barcelona to victory in the Copa del Rey before leaving for the French capital before the start of the new campaign."
25,"Messi, 34, won Copa America with his country last summer, as well as leading Barcelona to victory in the Copa del Rey before leaving for the French capital before the start of the new campaign.",Lionel Messi AND Cristiano Ronaldo are snubbed in L'Equipe's Team of 2021,"Lionel Messi AND Cristiano Ronaldo are snubbed in L'Equipe's Team of 2021.Messi, 34, won Copa America with his country last summer, as well as leading Barcelona to victory in the Copa del Rey before leaving for the French capital before the start of the new campaign."
26,"Paris Saint-Germain (PSG) superstar Lionel Messi left Argentina for France on Wednesday morning after testing negative for COVID, according to Argentine outlet El Litoral.",Lionel Messi could return to PSG training on Thursday after testing negative for COVID-19: Reports,"Lionel Messi could return to PSG training on Thursday after testing negative for COVID-19: Reports.Paris Saint-Germain (PSG) superstar Lionel Messi left Argentina for France on Wednesday morning after testing negative for COVID, according to Argentine outlet El Litoral."
27,"Paris Saint-Germain star Lionel Messi and Manchester United striker Cristiano Ronaldo were not considered good enough to make French magazine L’Equipe world team of the year. The snub was despite Messi scooping a seventh Ballon d’Or in 2021,","Messi, Ronaldo snubbed in World Team of the Year","Messi, Ronaldo snubbed in World Team of the Year.Paris Saint-Germain star Lionel Messi and Manchester United striker Cristiano Ronaldo were not considered good enough to make French magazine L’Equipe world team of the year. The snub was despite Messi scooping a seventh Ballon d’Or in 2021,"
28,"DJ Fer Palacio was pictured at a party with Messi just days before the Argentine star tested positive, but there is no suggestion he gave Messi COVID.",A DJ in Lionel Messi's hometown says he has been sent death threats after unfounded rumors that he gave the soccer star COVID,"A DJ in Lionel Messi's hometown says he has been sent death threats after unfounded rumors that he gave the soccer star COVID.DJ Fer Palacio was pictured at a party with Messi just days before the Argentine star tested positive, but there is no suggestion he gave Messi COVID."
29,An Argentinian DJ has denied he gave Lionel Messi Covid after receiving death threats on social media. Messi’s club Paris Saint-Germain confirmed on Sunday the Argentine international was among their players who had tested positive.,DJ denies giving Lionel Messi Covid after receiving death threats,DJ denies giving Lionel Messi Covid after receiving death threats.An Argentinian DJ has denied he gave Lionel Messi Covid after receiving death threats on social media. Messi’s club Paris Saint-Germain confirmed on Sunday the Argentine international was among their players who had tested positive.
30,ANDREAS CHRISTENSEN has signed up to an agency with strong links to Lionel Messi’s brother – fuelling speculation he is Barcelona bound. Chelsea’s Danish centre-half is out of contract at,Chelsea star Christensen signs with agency linked to Lionel Messi’s brother fuelling Barcelona transfer talk,Chelsea star Christensen signs with agency linked to Lionel Messi’s brother fuelling Barcelona transfer talk.ANDREAS CHRISTENSEN has signed up to an agency with strong links to Lionel Messi’s brother – fuelling speculation he is Barcelona bound. Chelsea’s Danish centre-half is out of contract at
31,"Reacting to Romelu Lukaku's interview where he criticised Chelsea manager Thomas Tuchel's decision to ""play a different formation"", ex-West Ham player Paolo Di Canio termed Lukaku a ""big soppy cat"" and ""no Lionel Messi"".","Lukaku a soppy cat, no Messi: Di Canio after controversial interview","Lukaku a soppy cat, no Messi: Di Canio after controversial interview.Reacting to Romelu Lukaku's interview where he criticised Chelsea manager Thomas Tuchel's decision to ""play a different formation"", ex-West Ham player Paolo Di Canio termed Lukaku a ""big soppy cat"" and ""no Lionel Messi""."
32,"After reportedly falling out with one of his teammates at Paris Saint-Germain earlier this season, Lionel Messi appears to be close to getting his January transfer wish.",Messi Gets January Transfer Wish?,"Messi Gets January Transfer Wish?.After reportedly falling out with one of his teammates at Paris Saint-Germain earlier this season, Lionel Messi appears to be close to getting his January transfer wish."
33,"THE January transfer window is officially OPEN and trading can begin! Lionel Messi has been ruled out of action with PSG thanks to Covid, but a return to Barcelona could STILL be on the cards","Transfer news LIVE: Southampton takeover LATEST, Messi return to Barca who target Haaland, Lukaku Chelsea future latest","Transfer news LIVE: Southampton takeover LATEST, Messi return to Barca who target Haaland, Lukaku Chelsea future latest.THE January transfer window is officially OPEN and trading can begin! Lionel Messi has been ruled out of action with PSG thanks to Covid, but a return to Barcelona could STILL be on the cards"
34,CHELSEA star Andreas Christensen has signed up to an agency with strong links to Leo Messi’s brother – fuelling speculation he is heading to Barcelona. The Danish defender is out of contract,Chelsea defender Andreas Christensen signs with agency linked to Leo Messi’s brother fuelling Barca transfer rumours,Chelsea defender Andreas Christensen signs with agency linked to Leo Messi’s brother fuelling Barca transfer rumours.CHELSEA star Andreas Christensen has signed up to an agency with strong links to Leo Messi’s brother – fuelling speculation he is heading to Barcelona. The Danish defender is out of contract
35,Lionel Messi is isolating at home in Argentina after testing positive for Covid-19—one of four Paris Saint-Germain players to do so ahead of the team’s return from winter break. PSG coach Mauricio Pochettino is not sure when the seven-time Ballon d’Or winner will be able to return to France—or if he can even recover in,Lionel Messi One Of Four PSG Players To Test Positive For COVID-19,Lionel Messi One Of Four PSG Players To Test Positive For COVID-19.Lionel Messi is isolating at home in Argentina after testing positive for Covid-19—one of four Paris Saint-Germain players to do so ahead of the team’s return from winter break. PSG coach Mauricio Pochettino is not sure when the seven-time Ballon d’Or winner will be able to return to France—or if he can even recover in
36,Barcelona president Joan Laporta has debunked reports circulating in the media that he asked Lionel Messi to play,Laporta Denies Asking Messi To Play For Free,Laporta Denies Asking Messi To Play For Free.Barcelona president Joan Laporta has debunked reports circulating in the media that he asked Lionel Messi to play
37,"<p><span style=""color: rgb(77, 81, 86); font-family: arial, sans-serif; font-size: 14px; font-style: normal; font-variant-ligatures: normal; font-variant-caps: normal; font-weight: 400; letter-spacing: normal; orphans: 2; text-align: left; text-indent: 0px; text-transform: none; white-space: normal; widows: 2; word-spacing: 0px; -webkit-text-stroke-width: 0px; background-color: rgb(255, 255, 255); text-decoration-thickness: initial; text-decoration-style: initial; text-decoration-color: initial; display: inline !important; float: none;"">Lionel Andrés Messi Cuccittini, còn được gọi là Leo Messi, là một cầu thủ bóng đá người Argentina hiện đang thi đấu ở vị trí tiền đạo cho câu lạc bộ Paris Saint-Germain và là đội trưởng của đội tuyển bóng đá quốc gia Argentina</span><br><br><br></p>","Messi và Sanchez cùng nổ súng, Chile cầm chân Argentina ở vòng loại World Cup","Messi và Sanchez cùng nổ súng, Chile cầm chân Argentina ở vòng loại World Cup.<p><span style=""color: rgb(77, 81, 86); font-family: arial, sans-serif; font-size: 14px; font-style: normal; font-variant-ligatures: normal; font-variant-caps: normal; font-weight: 400; letter-spacing: normal; orphans: 2; text-align: left; text-indent: 0px; text-transform: none; white-space: normal; widows: 2; word-spacing: 0px; -webkit-text-stroke-width: 0px; background-color: rgb(255, 255, 255); text-decoration-thickness: initial; text-decoration-style: initial; text-decoration-color: initial; display: inline !important; float: none;"">Lionel Andrés Messi Cuccittini, còn được gọi là Leo Messi, là một cầu thủ bóng đá người Argentina hiện đang thi đấu ở vị trí tiền đạo cho câu lạc bộ Paris Saint-Germain và là đội trưởng của đội tuyển bóng đá quốc gia Argentina</span><br><br><br></p>"
38,<p>Lionel Messi<br></p>,Lionel Messi,Lionel Messi.<p>Lionel Messi<br></p>
39,"<p class=""Normal"" style=""margin: 0px 0px 1em; padding: 0px; box-sizing: border-box; text-rendering: optimizespeed; line-height: 28.8px; color: rgb(34, 34, 34); font-family: arial; font-size: 18px; font-style: normal; font-variant-ligatures: normal; font-variant-caps: normal; font-weight: 400; letter-spacing: normal; orphans: 2; text-align: start; text-indent: 0px; text-transform: none; white-space: normal; widows: 2; word-spacing: 0px; -webkit-text-stroke-width: 0px; background-color: rgb(252, 250, 246); text-decoration-thickness: initial; text-decoration-style: initial; text-decoration-color: initial;"">Ông Bartomeu, Chủ tịch Barcelona có biệt danh là ""Nobita"", vì vẻ ngoài rất giống với nhân vật trong bộ truyện tranh nổi tiếng của Nhật Bản. Trong một buổi phỏng vấn gần đây trên đài truyền hình địa phương, ông Bartomeu đưa ra so sánh đầy hình ảnh, từ những câu hỏi của trẻ em.</p><p class=""Normal"" style=""margin: 0px 0px 1em; padding: 0px; box-sizing: border-box; text-rendering: optimizespeed; line-height: 28.8px; color: rgb(34, 34, 34); font-family: arial; font-size: 18px; font-style: normal; font-variant-ligatures: normal; font-variant-caps: normal; font-weight: 400; letter-spacing: normal; orphans: 2; text-align: start; text-indent: 0px; text-transform: none; white-space: normal; widows: 2; word-spacing: 0px; -webkit-text-stroke-width: 0px; background-color: rgb(252, 250, 246); text-decoration-thickness: initial; text-decoration-style: initial; text-decoration-color: initial;"">""Tôi đoán mọi người gọi tôi là Nobita vì trông tôi giống thế, hoặc có thể là Barcelona có một Doraemon. Cậu ta chính là Messi, người có thể giải quyết mọi tình huống khó khăn. Đó là lý do luôn có một Nobita nhờ vả cậu ấy trong mọi việc"", Chủ tịch Barca nói.&nbsp;</p><p><br></p>","Messi và Sanchez cùng nổ súng, Chile cầm chân Argentina ở vòng loại World Cup, Messi và Sanchez cùng nổ súng, Chile cầm chân Argentina ở vòng loại World Cup","Messi và Sanchez cùng nổ súng, Chile cầm chân Argentina ở vòng loại World Cup, Messi và Sanchez cùng nổ súng, Chile cầm chân Argentina ở vòng loại World Cup.<p class=""Normal"" style=""margin: 0px 0px 1em; padding: 0px; box-sizing: border-box; text-rendering: optimizespeed; line-height: 28.8px; color: rgb(34, 34, 34); font-family: arial; font-size: 18px; font-style: normal; font-variant-ligatures: normal; font-variant-caps: normal; font-weight: 400; letter-spacing: normal; orphans: 2; text-align: start; text-indent: 0px; text-transform: none; white-space: normal; widows: 2; word-spacing: 0px; -webkit-text-stroke-width: 0px; background-color: rgb(252, 250, 246); text-decoration-thickness: initial; text-decoration-style: initial; text-decoration-color: initial;"">Ông Bartomeu, Chủ tịch Barcelona có biệt danh là ""Nobita"", vì vẻ ngoài rất giống với nhân vật trong bộ truyện tranh nổi tiếng của Nhật Bản. Trong một buổi phỏng vấn gần đây trên đài truyền hình địa phương, ông Bartomeu đưa ra so sánh đầy hình ảnh, từ những câu hỏi của trẻ em.</p><p class=""Normal"" style=""margin: 0px 0px 1em; padding: 0px; box-sizing: border-box; text-rendering: optimizespeed; line-height: 28.8px; color: rgb(34, 34, 34); font-family: arial; font-size: 18px; font-style: normal; font-variant-ligatures: normal; font-variant-caps: normal; font-weight: 400; letter-spacing: normal; orphans: 2; text-align: start; text-indent: 0px; text-transform: none; white-space: normal; widows: 2; word-spacing: 0px; -webkit-text-stroke-width: 0px; background-color: rgb(252, 250, 246); text-decoration-thickness: initial; text-decoration-style: initial; text-decoration-color: initial;"">""Tôi đoán mọi người gọi tôi là Nobita vì trông tôi giống thế, hoặc có thể là Barcelona có một Doraemon. Cậu ta chính là Messi, người có thể giải quyết mọi tình huống khó khăn. Đó là lý do luôn có một Nobita nhờ vả cậu ấy trong mọi việc"", Chủ tịch Barca nói.&nbsp;</p><p><br></p>"
