267,"After FC Barcelona stalwart Dani Alves made his official return to the La Liga giant, president Joan Laporta would not dismiss the possibility of club legends Messi and Iniesta doing the same.","Lionel Messi and Andres Iniesta could return to FC Barcelona one day, says president Joan Laporta","Lionel Messi and Andres Iniesta could return to FC Barcelona one day, says president Joan Laporta.After FC Barcelona stalwart Dani Alves made his official return to the La Liga giant, president Joan Laporta would not dismiss the possibility of club legends Messi and Iniesta doing the same."
268,"After FC Barcelona stalwart Dani Alves made his official return to the La Liga giant, president Joan Laporta would not dismiss the possibility of club legends Messi and Iniesta doing the same.","Lionel Messi and Andres Iniesta could return to FC Barcelona one day, says president Joan Laporta","Lionel Messi and Andres Iniesta could return to FC Barcelona one day, says president Joan Laporta.After FC Barcelona stalwart Dani Alves made his official return to the La Liga giant, president Joan Laporta would not dismiss the possibility of club legends Messi and Iniesta doing the same."
269,"The top 50 dribblers in world football have been revealed, using the vast Football Manager 2022 database, with Lionel Messi, Kylian Mbappe and Eden Hazard all represented at the top of the rankings.",Ranking football's 50 best dribblers with FM22 including Lionel Messi and Kylian Mbappe,"Ranking football's 50 best dribblers with FM22 including Lionel Messi and Kylian Mbappe.The top 50 dribblers in world football have been revealed, using the vast Football Manager 2022 database, with Lionel Messi, Kylian Mbappe and Eden Hazard all represented at the top of the rankings."
270,"Barcelona president Joan Laporta has suggested Lionel Messi could follow in Dani Alves' footsteps and return to the club one day. It's been a month of returns at Camp Nou, with Barca legend Xavi replacing Ronald Koeman as manager and making Alves his first signing.",Barcelona president Joan Laporta in intriguing Lionel Messi claim - 'I can't rule it out',"Barcelona president Joan Laporta in intriguing Lionel Messi claim - 'I can't rule it out'.Barcelona president Joan Laporta has suggested Lionel Messi could follow in Dani Alves' footsteps and return to the club one day. It's been a month of returns at Camp Nou, with Barca legend Xavi replacing Ronald Koeman as manager and making Alves his first signing."
271,Gus Poyet believes Mohamed Salah is the best of the Ballon d'Or picks this year and puts him above Lionel Messi and Cristiano Ronaldo.,Ballon d'Or 2021 - Gus Poyet says Mohamed Salah is 'the best' ahead of Lionel Messi and Cristiano Ronaldo,Ballon d'Or 2021 - Gus Poyet says Mohamed Salah is 'the best' ahead of Lionel Messi and Cristiano Ronaldo.Gus Poyet believes Mohamed Salah is the best of the Ballon d'Or picks this year and puts him above Lionel Messi and Cristiano Ronaldo.
272,Barcelona president Joan Laporta says he is not ruling out the possibility of Lionel Messi and Andres Iniesta returning to the club.,Messi & Iniesta Barcelona returns not ruled out by president Laporta,Messi & Iniesta Barcelona returns not ruled out by president Laporta.Barcelona president Joan Laporta says he is not ruling out the possibility of Lionel Messi and Andres Iniesta returning to the club.
273,"Argentina icon, Lionel Messi is widely considered to be the greatest player in the history of football, with the striker winning numerous professional and indiv",Lionel Messi needs to go past 11 players to hold World Cup record,"Lionel Messi needs to go past 11 players to hold World Cup record.Argentina icon, Lionel Messi is widely considered to be the greatest player in the history of football, with the striker winning numerous professional and indiv"
274,"LIONEL MESSI says he struggled to keep up with the fierce pace of last night’s World Cup qualifying clash for Argentina vs Brazil. The 34-year-old has been injured of late, missing Paris",Lionel Messi says he struggled to keep up with intensity of Brazil clash after injury comeback for Argentina,"Lionel Messi says he struggled to keep up with intensity of Brazil clash after injury comeback for Argentina.LIONEL MESSI says he struggled to keep up with the fierce pace of last night’s World Cup qualifying clash for Argentina vs Brazil. The 34-year-old has been injured of late, missing Paris"
275,Barcelona president Joan Laporta has refused to rule out Lionel Messi and Andres Iniesta one day returning to the club. His comments come with Xavi recently taking charge of the club and making Dani Alves his first signing.,Barcelona president Joan Laporta refuses to rule out Lionel Messi and Andres Iniesta return,Barcelona president Joan Laporta refuses to rule out Lionel Messi and Andres Iniesta return.Barcelona president Joan Laporta has refused to rule out Lionel Messi and Andres Iniesta one day returning to the club. His comments come with Xavi recently taking charge of the club and making Dani Alves his first signing.
276,"The latter was asked about whether Lionel Messi or Andres Iniesta might also return to Barcelona like Alves, and he did not say no. “I don’t rule it out,&rdquor; said Laporta.",Joan Laporta: Messi or Iniesta returning? I don't rule it out,"Joan Laporta: Messi or Iniesta returning? I don't rule it out.The latter was asked about whether Lionel Messi or Andres Iniesta might also return to Barcelona like Alves, and he did not say no. “I don’t rule it out,&rdquor; said Laporta."
277,LIONEL MESSI had NO idea Argentina had qualified for the World Cup in Qatar until after the 0-0 draw with South American rivals Brazil. The two and five-time World Cup winners played out a feisty,Lionel Messi had no idea Argentina qualified for World Cup after goalless draw with Brazil seals place in Qatar,Lionel Messi had no idea Argentina qualified for World Cup after goalless draw with Brazil seals place in Qatar.LIONEL MESSI had NO idea Argentina had qualified for the World Cup in Qatar until after the 0-0 draw with South American rivals Brazil. The two and five-time World Cup winners played out a feisty
278,Gus Poyet believes Mohamed Salah is the best of the Ballon d'Or picks this year and puts him above Lionel Messi and Cristiano Ronaldo.,Ballon d'Or 2021 - Gus Poyet says Mohamed Salah is 'the best' ahead of Lionel Messi and Cristiano Ronaldo,Ballon d'Or 2021 - Gus Poyet says Mohamed Salah is 'the best' ahead of Lionel Messi and Cristiano Ronaldo.Gus Poyet believes Mohamed Salah is the best of the Ballon d'Or picks this year and puts him above Lionel Messi and Cristiano Ronaldo.
279,"Argentina and Paris Saint-Germain forward Lionel Messi said Tuesday he is still working to regain peak physical fitness after overcoming knee and hamstring injuries. Messi admitted he was lacking sharpness in Argentina's goalless home draw with Brazil in a World Cup qualifier here on Tuesday,",Messi searching for 'rhythm' to finish 2021 on high,"Messi searching for 'rhythm' to finish 2021 on high.Argentina and Paris Saint-Germain forward Lionel Messi said Tuesday he is still working to regain peak physical fitness after overcoming knee and hamstring injuries. Messi admitted he was lacking sharpness in Argentina's goalless home draw with Brazil in a World Cup qualifier here on Tuesday,"
280,Aston Villa’s Emiliano Martinez was labelled a ‘phenomenon’ by Lionel Messi but is yet to recapture this form for his club this season,Lionel Messi's 'phenomenon' struggling to recapture last season's form for Aston Villa,Lionel Messi's 'phenomenon' struggling to recapture last season's form for Aston Villa.Aston Villa’s Emiliano Martinez was labelled a ‘phenomenon’ by Lionel Messi but is yet to recapture this form for his club this season
281,Barcelona president Joan Laporta has refused to rule out a potential Lionel Messi return as they continue to sort out their off-field issues,Barca president Joan Laporta refuses to rule out a sensational Lionel Messi and Iniesta return,Barca president Joan Laporta refuses to rule out a sensational Lionel Messi and Iniesta return.Barcelona president Joan Laporta has refused to rule out a potential Lionel Messi return as they continue to sort out their off-field issues
282,"Barcelona president Joan Laporta has refused to rule out the possibility of club legends Lionel Messi and Andres Iniesta returning to the club following the arrival of Dani Alves at the Camp Nou. The Brazilian is back for a second spell and was unveiled at a ceremony at the Camp Nou on Wednesday,",Barcelona President Talks Possibility of Messi & Iniesta Returns,"Barcelona President Talks Possibility of Messi & Iniesta Returns.Barcelona president Joan Laporta has refused to rule out the possibility of club legends Lionel Messi and Andres Iniesta returning to the club following the arrival of Dani Alves at the Camp Nou. The Brazilian is back for a second spell and was unveiled at a ceremony at the Camp Nou on Wednesday,"
283,"Having played the full 90 minutes tonight in Argentina’s World Cup qualifier against Brazil, Lionel Messi will return to Paris today, reports Loïc Tanzi of RMC Sport. The forward has now recovered from his knee injury which had kept him out of Paris Saint-Germain’s last two matches,",Lionel Messi returns to Paris after playing full game against Brazil,"Lionel Messi returns to Paris after playing full game against Brazil.Having played the full 90 minutes tonight in Argentina’s World Cup qualifier against Brazil, Lionel Messi will return to Paris today, reports Loïc Tanzi of RMC Sport. The forward has now recovered from his knee injury which had kept him out of Paris Saint-Germain’s last two matches,"
284,Barcelona president Joan Laporta has refused to rule out the possibility of Lionel Messi joining Xavi and Dani Alves in returning to the Camp Nou before retiring,"Lionel Messi ""certain"" he'll return to Barcelona as Joan Laporta opens the door","Lionel Messi ""certain"" he'll return to Barcelona as Joan Laporta opens the door.Barcelona president Joan Laporta has refused to rule out the possibility of Lionel Messi joining Xavi and Dani Alves in returning to the Camp Nou before retiring"
285,"While outshining his numerous illustrious teammates, Lionel Messi has shared the pitch with some of the greatest players in football.",5 star players who could complement Lionel Messi at PSG,"5 star players who could complement Lionel Messi at PSG.While outshining his numerous illustrious teammates, Lionel Messi has shared the pitch with some of the greatest players in football."
286,Barcelona president Joan Laporta has said he won't rule out bringing Lionel Messi and Andres Iniesta back after the signing of Dani Alves.,"Barcelona president Laporta refuses to rule out Messi, Iniesta return after Alves reunion","Barcelona president Laporta refuses to rule out Messi, Iniesta return after Alves reunion.Barcelona president Joan Laporta has said he won't rule out bringing Lionel Messi and Andres Iniesta back after the signing of Dani Alves."
287,"FC Barcelona unveiled the signing of Dani Alves on Wednesday in a reunion that shocked world football. Of course, club president Joan Laporta was asked if they would ever consider bringing back Lionel Messi,",Barcelona president Joan Laporta drops truth bomb on potential Lionel Messi reunion,"Barcelona president Joan Laporta drops truth bomb on potential Lionel Messi reunion.FC Barcelona unveiled the signing of Dani Alves on Wednesday in a reunion that shocked world football. Of course, club president Joan Laporta was asked if they would ever consider bringing back Lionel Messi,"
288,"FC Barcelona unveiled the signing of Dani Alves on Wednesday in a reunion that shocked world football. Of course, club president Joan Laporta was asked if they would ever consider bringing back Lionel Messi,",Barcelona president Joan Laporta drops truth bomb on potential Lionel Messi reunion,"Barcelona president Joan Laporta drops truth bomb on potential Lionel Messi reunion.FC Barcelona unveiled the signing of Dani Alves on Wednesday in a reunion that shocked world football. Of course, club president Joan Laporta was asked if they would ever consider bringing back Lionel Messi,"
289,Lionel Messi has revealed that the Argentina squad knew that facing Brazil in the World Cup qualifiers was going to be a tough match but admitted that they did well not to lose as they continue to grow.,"Important thing is we are doing well and continue to grow, reveals Lionel Messi","Important thing is we are doing well and continue to grow, reveals Lionel Messi.Lionel Messi has revealed that the Argentina squad knew that facing Brazil in the World Cup qualifiers was going to be a tough match but admitted that they did well not to lose as they continue to grow."
290,"Speaking at the unveiling of Dani Alves, Barca president Joan Laporta did not rule out the return of Lionel Messi and Andres Iniesta.",Could Messi and Iniesta join Xavi and Alves in Barcelona reunion?,"Could Messi and Iniesta join Xavi and Alves in Barcelona reunion?.Speaking at the unveiling of Dani Alves, Barca president Joan Laporta did not rule out the return of Lionel Messi and Andres Iniesta."
291,"Barcelona president Joan Laporta says that both Andres Iniesta and Lionel Messi could return to Camp Nou in the future. Xavi was recently confirmed as the Catalan club's new head coach, and the Spaniard has brought experienced defender Dani Alves back to Camp Nou on a free transfer.","Joan Laporta: 'Lionel Messi, Andres Iniesta could return to Barcelona'","Joan Laporta: 'Lionel Messi, Andres Iniesta could return to Barcelona'.Barcelona president Joan Laporta says that both Andres Iniesta and Lionel Messi could return to Camp Nou in the future. Xavi was recently confirmed as the Catalan club's new head coach, and the Spaniard has brought experienced defender Dani Alves back to Camp Nou on a free transfer."
292,"Barcelona president Joan Laporta says that both Andres Iniesta and Lionel Messi could return to Camp Nou in the future. Xavi was recently confirmed as the Catalan club's new head coach, and the Spaniard has brought experienced defender Dani Alves back to Camp Nou on a free transfer.","Joan Laporta: 'Lionel Messi, Andres Iniesta could return to Barcelona'","Joan Laporta: 'Lionel Messi, Andres Iniesta could return to Barcelona'.Barcelona president Joan Laporta says that both Andres Iniesta and Lionel Messi could return to Camp Nou in the future. Xavi was recently confirmed as the Catalan club's new head coach, and the Spaniard has brought experienced defender Dani Alves back to Camp Nou on a free transfer."
293,Lionel Messi is getting closer and closer to the end of his football career. His achievements are almost unparalleled and his performances are something that will be studied for decades or even centuries.,PSG’s results since the arrival of Lionel Messi,PSG’s results since the arrival of Lionel Messi.Lionel Messi is getting closer and closer to the end of his football career. His achievements are almost unparalleled and his performances are something that will be studied for decades or even centuries.
294,Lionel Messi has reacted after Argentina’s goal-less draw against Brazil in the 2022 FIFA World Cup qualifiers and claimed both teams tried their best on the counter to net the goal. Argentina have now qualified for the Qatar World Cup after the draw as they are currently placed at the second spot in South American qualifiers.,"Lionel Messi Opens up on His Fitness After Draw Against Brazil, Hopes to Finish Year Well","Lionel Messi Opens up on His Fitness After Draw Against Brazil, Hopes to Finish Year Well.Lionel Messi has reacted after Argentina’s goal-less draw against Brazil in the 2022 FIFA World Cup qualifiers and claimed both teams tried their best on the counter to net the goal. Argentina have now qualified for the Qatar World Cup after the draw as they are currently placed at the second spot in South American qualifiers."
295,"Forward for the Argentina national team and PSG Lionel Messi has been named the top player of the year, based on Goal.com’s survey. Based on the results of the survey of 14,000,000 people, Messi, who spent half of the year in FC Barcelona,",Lionel Messi named top footballer of the year,"Lionel Messi named top footballer of the year.Forward for the Argentina national team and PSG Lionel Messi has been named the top player of the year, based on Goal.com’s survey. Based on the results of the survey of 14,000,000 people, Messi, who spent half of the year in FC Barcelona,"
296,"Argentina secured a place in next year’s World Cup after a 0-0 draw against Brazil, giving Lionel Messi his fifth and possibly final shot at winning the only major trophy missing in his career. Second-place Argentina qualified after Chile lost 2-0 at home to third-place Ecuador.","Lacklustre Lionel Messi show as Argentina hold Brazil, but qualify for FIFA 2022 World Cup","Lacklustre Lionel Messi show as Argentina hold Brazil, but qualify for FIFA 2022 World Cup.Argentina secured a place in next year’s World Cup after a 0-0 draw against Brazil, giving Lionel Messi his fifth and possibly final shot at winning the only major trophy missing in his career. Second-place Argentina qualified after Chile lost 2-0 at home to third-place Ecuador."
297,"LIONEL MESSI admitted he struggled to keep up with the ferocious pace of last night’s Argentina vs Brazil clash. The 34-year-old has been injured of late, missing Paris Saint-Germain’s",Lionel Messi admits he struggled to keep up with intensity of Brazil clash after making return from injury for Argentina,"Lionel Messi admits he struggled to keep up with intensity of Brazil clash after making return from injury for Argentina.LIONEL MESSI admitted he struggled to keep up with the ferocious pace of last night’s Argentina vs Brazil clash. The 34-year-old has been injured of late, missing Paris Saint-Germain’s"
298,Barcelona president Joan Laporta says he will not rule out trying to bring back Lionel Messi and Andres Iniesta to the club after presenting Dani Alves.,"Lionel Messi and Andres Iniesta returning to Barcelona cannot be ruled out, says club president Joan Laporta","Lionel Messi and Andres Iniesta returning to Barcelona cannot be ruled out, says club president Joan Laporta.Barcelona president Joan Laporta says he will not rule out trying to bring back Lionel Messi and Andres Iniesta to the club after presenting Dani Alves."
299,"With the Ballon D'or 2021 ceremony inching nearer, Lionel Messi might just win it for a historic seventh time. Here's why.",Here’s why Lionel Messi should win Ballon d’Or in 2021,"Here’s why Lionel Messi should win Ballon d’Or in 2021.With the Ballon D'or 2021 ceremony inching nearer, Lionel Messi might just win it for a historic seventh time. Here's why."
300,"Lionel Messi will play for Argentina when they face Brazil on Tuesday in a World Cup qualifier, said coach Lionel Scaloni. The match could earn the team a spot in next year's World Cup. Brazil already has one of the four automatic qualifying spots from the region but has not won in Argentina since 2009.","FIFA World Cup Qualifiers: Lionel Messi in, Neymar out of Argentina vs Brazil in World Cup qualifying","FIFA World Cup Qualifiers: Lionel Messi in, Neymar out of Argentina vs Brazil in World Cup qualifying.Lionel Messi will play for Argentina when they face Brazil on Tuesday in a World Cup qualifier, said coach Lionel Scaloni. The match could earn the team a spot in next year's World Cup. Brazil already has one of the four automatic qualifying spots from the region but has not won in Argentina since 2009."
301,"Barcelona are working on a deal to sign Mohamed Salah with new boss Xavi seeing the Liverpool man as key to a revival in the club’s fortunes, writes the Daily Mirror. Salah has 18 months left on his contract and the Catalan club are keen to land a marquee signing after losing Lionel Messi and Antoine Griezmann,",Football rumours: Barcelona plotting move for marquee signing Mohamed Salah,"Football rumours: Barcelona plotting move for marquee signing Mohamed Salah.Barcelona are working on a deal to sign Mohamed Salah with new boss Xavi seeing the Liverpool man as key to a revival in the club’s fortunes, writes the Daily Mirror. Salah has 18 months left on his contract and the Catalan club are keen to land a marquee signing after losing Lionel Messi and Antoine Griezmann,"
302,Argentina coach Lionel Scaloni has confirmed that captain and talismanic forward Lionel Messi will play in La Albiceleste's match against Brazil.,"""It's confirmed that he will play"" - Argentina coach Lionel Scaloni confirms Lionel Messi's presence against Brazil","""It's confirmed that he will play"" - Argentina coach Lionel Scaloni confirms Lionel Messi's presence against Brazil.Argentina coach Lionel Scaloni has confirmed that captain and talismanic forward Lionel Messi will play in La Albiceleste's match against Brazil."
303,"Thierry Henry has snubbed his former FC Barcelona teammate Lionel Messi and has backed Real Madrid Karim Benzema and Chelsea's N'Golo Kante to win the Ballon d'Or award this year. Messi has won Ballon d'Or,","Ex-Barcelona Forward Snubs Messi For Ballon d'Or, Hopes It Is Benzema Or N'Golo Kante","Ex-Barcelona Forward Snubs Messi For Ballon d'Or, Hopes It Is Benzema Or N'Golo Kante.Thierry Henry has snubbed his former FC Barcelona teammate Lionel Messi and has backed Real Madrid Karim Benzema and Chelsea's N'Golo Kante to win the Ballon d'Or award this year. Messi has won Ballon d'Or,"
304,"Argentina captain Lionel Messi, who missed out on PSG's last two games due to a knee injury, will play against Brazil in their 2022 FIFA World Cup qualifier. However, Brazil forward Neymar has been ruled out of the match with thigh pain.",Messi to play against Brazil in FIFA WC qualifier; Neymar out due to injury,"Messi to play against Brazil in FIFA WC qualifier; Neymar out due to injury.Argentina captain Lionel Messi, who missed out on PSG's last two games due to a knee injury, will play against Brazil in their 2022 FIFA World Cup qualifier. However, Brazil forward Neymar has been ruled out of the match with thigh pain."
305,"While Messi and Ronaldo can boast a staggering 11 Ballon d'Or awards between them, Neymar has never managed to land the prestigious prize - despite being nominated on no less than nine occasions. Neymar's current club Paris Saint-Germain thought so highly of the forward's ability that they agreed to pay Barcelona a world-record transfer fee of £190 million for his services in August 2017.","Neymar is technically better than Lionel Messi and Cristiano Ronaldo, claims Cafu","Neymar is technically better than Lionel Messi and Cristiano Ronaldo, claims Cafu.While Messi and Ronaldo can boast a staggering 11 Ballon d'Or awards between them, Neymar has never managed to land the prestigious prize - despite being nominated on no less than nine occasions. Neymar's current club Paris Saint-Germain thought so highly of the forward's ability that they agreed to pay Barcelona a world-record transfer fee of £190 million for his services in August 2017."
306,"Argentina national team head coach, Lionel Scaloni has confirmed that the country's icon and skipper, Lionel Messi will play rivals, Brazil in their FIFA 2022 W",Lionel Scaloni confirms that Lionel Messi will play against Brazil,"Lionel Scaloni confirms that Lionel Messi will play against Brazil.Argentina national team head coach, Lionel Scaloni has confirmed that the country's icon and skipper, Lionel Messi will play rivals, Brazil in their FIFA 2022 W"
307,"While Messi and Ronaldo can boast a staggering 11 Ballon d'Or awards between them, Neymar has never managed to land the prestigious prize - despite being nominated on no less than nine occasions. Neymar's current club Paris Saint-Germain thought so highly of the forward's ability that they agreed to pay Barcelona a world-record transfer fee of £190 million for his services in August 2017.","Neymar is technically better than Lionel Messi and Cristiano Ronaldo, claims Cafu","Neymar is technically better than Lionel Messi and Cristiano Ronaldo, claims Cafu.While Messi and Ronaldo can boast a staggering 11 Ballon d'Or awards between them, Neymar has never managed to land the prestigious prize - despite being nominated on no less than nine occasions. Neymar's current club Paris Saint-Germain thought so highly of the forward's ability that they agreed to pay Barcelona a world-record transfer fee of £190 million for his services in August 2017."
308,"BARCELONA are in the midst of an enormous decline and have had a nightmare 100 days since Lionel Messi left for Paris Saint-Germain. The Catalans have crippling debts in excess of £1BILLION,",Barcelona’s horror decline 100 days since Lionel Messi’s shock exit… from mammoth debt and empty stadium to Luuk de Jong,"Barcelona’s horror decline 100 days since Lionel Messi’s shock exit… from mammoth debt and empty stadium to Luuk de Jong.BARCELONA are in the midst of an enormous decline and have had a nightmare 100 days since Lionel Messi left for Paris Saint-Germain. The Catalans have crippling debts in excess of £1BILLION,"
