60d6dbd2b8e5fb1e5f4569c6,"Thor actor Chris Hemsworth almost danced his way out of a starring role in the Marvel Cinematic Universe. Best known at the time for his role as Kim Hyde on the soap opera Home and Away in his native Australia and his feature film debut as George Kirk in the 2009 Star Trek reboot,",Thor Actor Chris Hemsworth Almost Lost Marvel Role Because of Dancing With the Stars,"Thor actor Chris Hemsworth almost danced his way out of a starring role in the Marvel Cinematic Universe. Best known at the time for his role as Kim Hyde on the soap opera Home and Away in his native Australia and his feature film debut as George Kirk in the 2009 Star Trek reboot,.Thor Actor Chris Hemsworth Almost Lost Marvel Role Because of Dancing With the Stars"
60d6dbd2b8e5fb1e5f4569c5,"Thor actor Chris Hemsworth almost danced his way out of a starring role in the Marvel Cinematic Universe. Best known at the time for his role as Kim Hyde on the soap opera Home and Away in his native Australia and his feature film debut as George Kirk in the 2009 Star Trek reboot,",Thor Actor Chris Hemsworth Almost Lost Marvel Role Because of Dancing With the Stars,"Thor actor Chris Hemsworth almost danced his way out of a starring role in the Marvel Cinematic Universe. Best known at the time for his role as Kim Hyde on the soap opera Home and Away in his native Australia and his feature film debut as George Kirk in the 2009 Star Trek reboot,.Thor Actor Chris Hemsworth Almost Lost Marvel Role Because of Dancing With the Stars"
60d950bbb8e5fb1e5f45793d,"However, we almost did have a different God of Thunder, as Thor: Love and Thunder star Chris Hemsworth was almost passed over to play the fan-favorite hero. I can’t even begin to imagine what that alternate reality would look like,",Why Thor: Love And Thunder’s Chris Hemsworth Almost Lost Out On His Role As The God Of Thunder,"However, we almost did have a different God of Thunder, as Thor: Love and Thunder star Chris Hemsworth was almost passed over to play the fan-favorite hero. I can’t even begin to imagine what that alternate reality would look like,.Why Thor: Love And Thunder’s Chris Hemsworth Almost Lost Out On His Role As The God Of Thunder"
60d94bb2b8e5fb1e5f4578f1,"<p>Chris Pratt is opening up about his role in the upcoming “Thor: Love and Thunder”, where he will star as Peter Quill a.k.a. Starlord. The 42-year-old and Chris Hemsworth first appeared on screen together in “Avengers: Infinity War” and provided comic relief throughout the movie.</p>",Chris Pratt Reveals Thor & Quill’s Rivalry In ‘Thor: Love And Thunder’,"<p>Chris Pratt is opening up about his role in the upcoming “Thor: Love and Thunder”, where he will star as Peter Quill a.k.a. Starlord. The 42-year-old and Chris Hemsworth first appeared on screen together in “Avengers: Infinity War” and provided comic relief throughout the movie.</p>.Chris Pratt Reveals Thor & Quill’s Rivalry In ‘Thor: Love And Thunder’"
60dab854cd60e1352d779167,"<p>Although it's one of his signature roles, Chris Hemsworth almost didn't get the part of Thor. His appearance on this TV show nearly ended his chances.</p>",The TV Series That Almost Made Chris Hemsworth Lose Out On His Thor Role,"<p>Although it's one of his signature roles, Chris Hemsworth almost didn't get the part of Thor. His appearance on this TV show nearly ended his chances.</p>.The TV Series That Almost Made Chris Hemsworth Lose Out On His Thor Role"
60dbd8dbcd60e1352d77980d,"A great Chris Hemsworth movie will become available to stream on Netflix on July 1st, and it'll surely bring in a big audience.",A Great Chris Hemsworth Movies Hits Netflix This Week,"A great Chris Hemsworth movie will become available to stream on Netflix on July 1st, and it'll surely bring in a big audience..A Great Chris Hemsworth Movies Hits Netflix This Week"
60dd2ffbcd60e1352d779e10,"Also starring Chris Hemsworth, Natalie Portman, Russell Crowe, Chris Pratt, Christian Bale and Matt Damon among others, Thor: Love and Thunder is scheduled for a May 6, 2022 release.","Thor Love and Thunder: Fans will get to see Nebula’s ‘bonkers and wild’ side, says Karen Gillan","Also starring Chris Hemsworth, Natalie Portman, Russell Crowe, Chris Pratt, Christian Bale and Matt Damon among others, Thor: Love and Thunder is scheduled for a May 6, 2022 release..Thor Love and Thunder: Fans will get to see Nebula’s ‘bonkers and wild’ side, says Karen Gillan"
60dd3026cd60e1352d779e12,"In the hourlong SharkFest special Shark Beach With Chris Hemsworth, the actor and environmentalist best known as hammer-wielding superhero Thor in Marvel’s Avengers franchise investigates an alarming increase in attacks near where he lives and the beaches he surfs in eastern Australia.",Chris Hemsworth Hopes to ‘Do Away With Some Myths’ in ‘Shark Beach’ Special for NatGeo,"In the hourlong SharkFest special Shark Beach With Chris Hemsworth, the actor and environmentalist best known as hammer-wielding superhero Thor in Marvel’s Avengers franchise investigates an alarming increase in attacks near where he lives and the beaches he surfs in eastern Australia..Chris Hemsworth Hopes to ‘Do Away With Some Myths’ in ‘Shark Beach’ Special for NatGeo"
60dd2ffbcd60e1352d779e0c,"Make Sure To Check Out THIS Awesome Chris Hemsworth Movie Returning To Netflix! It's a small role, but it's cool to see!",Make Sure To Check Out THIS Awesome Chris Hemsworth Movie Returning To Netflix!,"Make Sure To Check Out THIS Awesome Chris Hemsworth Movie Returning To Netflix! It's a small role, but it's cool to see!.Make Sure To Check Out THIS Awesome Chris Hemsworth Movie Returning To Netflix!"
60de895fcd60e1352d77a495,"Only ET has your first look at 'Shark Beach With Chris Hemsworth,' airing July 5 on the National Geographic Channel.",See Chris Hemsworth’s Close Encounter With a Wild Shark (Exclusive),"Only ET has your first look at 'Shark Beach With Chris Hemsworth,' airing July 5 on the National Geographic Channel..See Chris Hemsworth’s Close Encounter With a Wild Shark (Exclusive)"
60de7255cd60e1352d77a458,"A great Chris Hemsworth movie is now streaming on Netflix, and will surely entice subscribers to the platform.",An Awesome Chris Hemsworth Movie Just Hit Netflix,"A great Chris Hemsworth movie is now streaming on Netflix, and will surely entice subscribers to the platform..An Awesome Chris Hemsworth Movie Just Hit Netflix"
60de8960cd60e1352d77a496,"National Geographic’s annual SharkFest is back, and to help kick things off this year is Thor himself. Chris Hemsworth is starring in a new documentary, Shark Beach With Chris Hemsworth, and ET has an exclusive behind-the-scenes look at the special.",Go Behind the Scenes of Chris Hemsworth's New 'Shark Beach' Doc (Exclusive),"National Geographic’s annual SharkFest is back, and to help kick things off this year is Thor himself. Chris Hemsworth is starring in a new documentary, Shark Beach With Chris Hemsworth, and ET has an exclusive behind-the-scenes look at the special..Go Behind the Scenes of Chris Hemsworth's New 'Shark Beach' Doc (Exclusive)"
60dec5accd60e1352d77a818,"Chris Hemsworth’s trainer Luke Zocchi and longtime stuntman Bobby Holland Hanton have shared what it takes to look like Thor. “Chris takes it very, very seriously, and the shape he gets into, it’s phenomenal,",Chris Hemsworth’s insane Thor diet revealed,"Chris Hemsworth’s trainer Luke Zocchi and longtime stuntman Bobby Holland Hanton have shared what it takes to look like Thor. “Chris takes it very, very seriously, and the shape he gets into, it’s phenomenal,.Chris Hemsworth’s insane Thor diet revealed"
60dfe592cd60e1352d77ae25,Watch the SHARK BEACH WITH CHRIS HEMSWORTH Trailer. Chris Hemsworth seeks to understand the reason behind the increase in local shark attacks and,SHARK BEACH WITH CHRIS HEMSWORTH Trailer,Watch the SHARK BEACH WITH CHRIS HEMSWORTH Trailer. Chris Hemsworth seeks to understand the reason behind the increase in local shark attacks and.SHARK BEACH WITH CHRIS HEMSWORTH Trailer
60dff7afcd60e1352d77aebd,Watch the Chris Hemsworth Swims With Sharks. Marvel star Chris Hemsworth is joined by legendary conservationist Valerie Taylor as they dive off the,Chris Hemsworth Swims With Sharks,Watch the Chris Hemsworth Swims With Sharks. Marvel star Chris Hemsworth is joined by legendary conservationist Valerie Taylor as they dive off the.Chris Hemsworth Swims With Sharks
60dfe7abcd60e1352d77ae60,Watch Chris Hemsworth get very personal with a shark in exclusive clip from 'Shark Beach With Chris Hemsworth.',"Watch Chris Hemsworth give a shark an anal swab: 'Let's dig in, shall we?","Watch Chris Hemsworth get very personal with a shark in exclusive clip from 'Shark Beach With Chris Hemsworth.'.Watch Chris Hemsworth give a shark an anal swab: 'Let's dig in, shall we?"
60e00fdecd60e1352d77afb5,"Typically, Hemsworth eats steak, chicken and fish or sweet potato with white rice for his mains, and has smaller meals like protein shakes in between. ""When we go into prep for movies like Thor, it's a massive increase in food,",Chris Hemsworth's trainer and stunt double reveal he eats eight meals a day to maintain his Thor physique,"Typically, Hemsworth eats steak, chicken and fish or sweet potato with white rice for his mains, and has smaller meals like protein shakes in between. ""When we go into prep for movies like Thor, it's a massive increase in food,.Chris Hemsworth's trainer and stunt double reveal he eats eight meals a day to maintain his Thor physique"
60e17c06cd60e1352d77b7a5,"National Geographic kicks off the ninth season of their annual SharkFest with the documentary “Shark Beach With Chris Hemsworth.” Although best known as the all-powerful Thor from the Marvel Cinematic Universe,",Chris Hemsworth investigates rise in shark attacks in new documentary,"National Geographic kicks off the ninth season of their annual SharkFest with the documentary “Shark Beach With Chris Hemsworth.” Although best known as the all-powerful Thor from the Marvel Cinematic Universe,.Chris Hemsworth investigates rise in shark attacks in new documentary"
60e2bb79cd60e1352d77c0b3,"He’s landed in some sticky situations as Thor in a string of Marvel movies, but collecting an anal swab from a shark was certainly a first for Chris Hemsworth.",Chris Hemsworth fronts ‘Shark Beach’ documentary airing in Australia tonight,"He’s landed in some sticky situations as Thor in a string of Marvel movies, but collecting an anal swab from a shark was certainly a first for Chris Hemsworth..Chris Hemsworth fronts ‘Shark Beach’ documentary airing in Australia tonight"
60e3bd7ccd60e1352d77c39b,"<p>“It’s like the end of an era.” Over the last few days, fans of Robert Downey Jr. have noticed that the “Iron Man” actor has unfollowed all of his former Marvel co-stars on Instagram. RELATED: Chris Hemsworth,</p>",Marvel Fans Distraught As Robert Downey Jr. Unfollows All His Superhero Co-Stars,"<p>“It’s like the end of an era.” Over the last few days, fans of Robert Downey Jr. have noticed that the “Iron Man” actor has unfollowed all of his former Marvel co-stars on Instagram. RELATED: Chris Hemsworth,</p>.Marvel Fans Distraught As Robert Downey Jr. Unfollows All His Superhero Co-Stars"
60e3c325cd60e1352d77c408,"CHRIS and Elsa have been married since 2010. The Marvel star Chris Hemsworth is married to Elsa Pataky. Who is Chris Hemsworth’s wife Elsa Pataky? Elsa Lafuente Medianu, professional known",Who is Chris Hemsworth’s wife Elsa Pataky and how old is she?,"CHRIS and Elsa have been married since 2010. The Marvel star Chris Hemsworth is married to Elsa Pataky. Who is Chris Hemsworth’s wife Elsa Pataky? Elsa Lafuente Medianu, professional known.Who is Chris Hemsworth’s wife Elsa Pataky and how old is she?"
60e3ea33cd60e1352d77c476,"""Shark Beach with Chris Hemsworth"" gets the annual National Geographic event started with an investigation into shark attacks by Thor himself.",'SharkFest 2021' Line-Up: Chris Hemsworth Kicks Off Six Weeks of Shark Action,"""Shark Beach with Chris Hemsworth"" gets the annual National Geographic event started with an investigation into shark attacks by Thor himself..'SharkFest 2021' Line-Up: Chris Hemsworth Kicks Off Six Weeks of Shark Action"
60e3ef71cd60e1352d77c4bc,"Chris Hemsworth is set to front Foxtel's new documentary Shark Beach. The Hollywood actor, 37, joins Dr Paul Butcher as they monitor sharks off the NSW mid-north coast. In a trailer for the documentary,",Chris Hemsworth dives with sharks in Foxtel's new documentary Shark Beach,"Chris Hemsworth is set to front Foxtel's new documentary Shark Beach. The Hollywood actor, 37, joins Dr Paul Butcher as they monitor sharks off the NSW mid-north coast. In a trailer for the documentary,.Chris Hemsworth dives with sharks in Foxtel's new documentary Shark Beach"
60e40828cd60e1352d77c59e,"<p>Shark Beach with Chris Hemsworth' kicks off Nat Geo's ""Sharkfest"" on Monday. Here's how you can watch it streaming online for free.</p>",How to Watch ‘Shark Beach with Chris Hemsworth’ Online Free,"<p>Shark Beach with Chris Hemsworth' kicks off Nat Geo's ""Sharkfest"" on Monday. Here's how you can watch it streaming online for free.</p>.How to Watch ‘Shark Beach with Chris Hemsworth’ Online Free"
60e43095cd60e1352d77c806,"Another day, another video of Chris Hemsworth being extremely Australian, which this time involves giving an anal swab to a great white shark – as you do. The Thor star got stuck in with a team of shark experts for part of his show,",Chris Hemsworth gives a three-metre shark an anal swab in the name of science,"Another day, another video of Chris Hemsworth being extremely Australian, which this time involves giving an anal swab to a great white shark – as you do. The Thor star got stuck in with a team of shark experts for part of his show,.Chris Hemsworth gives a three-metre shark an anal swab in the name of science"
60e43095cd60e1352d77c805,"Another day, another video of Chris Hemsworth being extremely Australian, which this time involves giving an anal swab to a great white shark – as you do. The Thor star got stuck in with a team of shark experts for part of his show,",Chris Hemsworth gives a three-metre great white shark an anal swab in the name of science,"Another day, another video of Chris Hemsworth being extremely Australian, which this time involves giving an anal swab to a great white shark – as you do. The Thor star got stuck in with a team of shark experts for part of his show,.Chris Hemsworth gives a three-metre great white shark an anal swab in the name of science"
60e43095cd60e1352d77c804,"Actor Chris Hemsworth took a break from being the big-time movie star that he is to host the documentary special, Shark Beach with Chris Hemsworth, to help kick off National Geographic’s Sharkfest celebration. In it he explores ways that sharks and ...",Chris Hemsworth comes face-to-face with ‘amazing’ shark to kick off Sharkfest,"Actor Chris Hemsworth took a break from being the big-time movie star that he is to host the documentary special, Shark Beach with Chris Hemsworth, to help kick off National Geographic’s Sharkfest celebration. In it he explores ways that sharks and ....Chris Hemsworth comes face-to-face with ‘amazing’ shark to kick off Sharkfest"
60e51d59cd60e1352d77cacf,"Chris Hemsworth will be seen in National Geographic's docuseries called, 'Chris Hemsworth Getting Familiar with Sharks’. Scroll down to find more details on it",Chris Hemsworth To 'swim With Sharks' For National Geographic’s New Docuseries,"Chris Hemsworth will be seen in National Geographic's docuseries called, 'Chris Hemsworth Getting Familiar with Sharks’. Scroll down to find more details on it.Chris Hemsworth To 'swim With Sharks' For National Geographic’s New Docuseries"
60e53100cd60e1352d77cc01,Chris Hemsworth's trainer just revealed the exact diet and exercise plan the star adheres to when he needs to get in shape for as Thor.,This Is Chris Hemsworth's Exact Meal and Exercise Plan to Get into 'Thor' Shape,Chris Hemsworth's trainer just revealed the exact diet and exercise plan the star adheres to when he needs to get in shape for as Thor..This Is Chris Hemsworth's Exact Meal and Exercise Plan to Get into 'Thor' Shape
60e56e53cd60e1352d77ce4d,"Chris Hemsworth got up, close and personal with sharks for a new documentary special. The actor kicked off National Geographic’s annual Sharkfest celebration with his doc “Shark Beach with Chris Hemsworth”,","Chris Hemsworth Gives A Great White Shark An Anal Swab In New Documentary Special: ‘Sorry About That, Mate’","Chris Hemsworth got up, close and personal with sharks for a new documentary special. The actor kicked off National Geographic’s annual Sharkfest celebration with his doc “Shark Beach with Chris Hemsworth”,.Chris Hemsworth Gives A Great White Shark An Anal Swab In New Documentary Special: ‘Sorry About That, Mate’"
60e56e53cd60e1352d77ce4e,"Thor alum Chris Hemsworth recently ventured into a daring sport for a new programme called Chris Hemsworth Getting Familiar with Sharks. Participating in National Geographic’s annual Shark Week, the 37-year-old MCU star featured in one episode of the series,",Chris Hemsworth swims in shark infested waters; Thor alum to uncover science behind their predatory behaviour,"Thor alum Chris Hemsworth recently ventured into a daring sport for a new programme called Chris Hemsworth Getting Familiar with Sharks. Participating in National Geographic’s annual Shark Week, the 37-year-old MCU star featured in one episode of the series,.Chris Hemsworth swims in shark infested waters; Thor alum to uncover science behind their predatory behaviour"
60e662b4cd60e1352d77d261,"<p>Remember, Samuel L. Jackson once famously agreed to nine movies in 2009, while Chris Evans and Chris Hemsworth committed to six-picture pacts. Now, things have changed. ""That got a lot of attention way back when, with I think Scarlett, and (Chris ...</p>",BLACK WIDOW: Kevin Feige Reveals Change To Marvel's Multi-Picture Deals; Check Out A New Featurette And Poster,"<p>Remember, Samuel L. Jackson once famously agreed to nine movies in 2009, while Chris Evans and Chris Hemsworth committed to six-picture pacts. Now, things have changed. ""That got a lot of attention way back when, with I think Scarlett, and (Chris ...</p>.BLACK WIDOW: Kevin Feige Reveals Change To Marvel's Multi-Picture Deals; Check Out A New Featurette And Poster"
60e688f3cd60e1352d77d3e6,"<p>While Loki's adoptive brother Thor (Chris Hemsworth) and rest of the Avengers are no where to be found in the series (well, at least so far — one never knows what might happen in a Marvel Cinematic Universe property), it's still evident to audiences that ...</p>",Loki Episode 5 Slipped A Thor: Ragnarok Reference Right Past You,"<p>While Loki's adoptive brother Thor (Chris Hemsworth) and rest of the Avengers are no where to be found in the series (well, at least so far — one never knows what might happen in a Marvel Cinematic Universe property), it's still evident to audiences that ...</p>.Loki Episode 5 Slipped A Thor: Ragnarok Reference Right Past You"
60e7a7bdcd60e1352d77d800,"<p>are: Chris Hemsworth (Thor), Tom Hiddleston (Loki), Michael B. Jordan (Killmonger), Samuel L. Jackson (Nick Fury), Mark Ruffalo (Bruce Banner/Hulk), Jeremy Renner (Clint Barton/Hawkeye ...</p>",Marvel’s ‘What If…?’ Trailer: Captain Carter & Chadwick Boseman’s Final Performance as T’Challa (VIDEO),"<p>are: Chris Hemsworth (Thor), Tom Hiddleston (Loki), Michael B. Jordan (Killmonger), Samuel L. Jackson (Nick Fury), Mark Ruffalo (Bruce Banner/Hulk), Jeremy Renner (Clint Barton/Hawkeye ...</p>.Marvel’s ‘What If…?’ Trailer: Captain Carter & Chadwick Boseman’s Final Performance as T’Challa (VIDEO)"
60e7a7cbcd60e1352d77d801,"<p>The likes of Chris Hemsworth, Michael B Jordan, Hayley Atwell, Mark Ruffalo, Tom Hiddleston, Sebastian Stan and the late Chadwick Boseman were already confirmed as part of the cast way back at San Diego Comic Con in 2019. Jeffrey Wright voices the Watcher ...</p>",Marvel's What If? show finally gets a release date – and a star-studded trailer,"<p>The likes of Chris Hemsworth, Michael B Jordan, Hayley Atwell, Mark Ruffalo, Tom Hiddleston, Sebastian Stan and the late Chadwick Boseman were already confirmed as part of the cast way back at San Diego Comic Con in 2019. Jeffrey Wright voices the Watcher ...</p>.Marvel's What If? show finally gets a release date – and a star-studded trailer"
60e81aa1cd60e1352d77dc17,"<p>His epic scream for MCU fans was reminiscent of Thor's (Chris Hemsworth) bellow when Loki cut off his hand while trying to yield the Mljonir in Thor: The Dark World. Given that President Loki is played by Tom himself, the 40-year-old actor spoke with ...</p>",Tom Hiddleston REVEALS playing 'most autocratic and terrifyingly ambitious' President Loki was 'quite surreal',"<p>His epic scream for MCU fans was reminiscent of Thor's (Chris Hemsworth) bellow when Loki cut off his hand while trying to yield the Mljonir in Thor: The Dark World. Given that President Loki is played by Tom himself, the 40-year-old actor spoke with ...</p>.Tom Hiddleston REVEALS playing 'most autocratic and terrifyingly ambitious' President Loki was 'quite surreal'"
60e81794cd60e1352d77dc00,"Thor Love and Thunder will not only feature Chris Hemsworth as the Asgardian God of Thunder, Natalie Portman's Jane Foster will also assume the identity of Thor and wield the Mjolnir.",Taika Waititi on Thor Love and Thunder: ‘It’s crazier and far more emotional’,"Thor Love and Thunder will not only feature Chris Hemsworth as the Asgardian God of Thunder, Natalie Portman's Jane Foster will also assume the identity of Thor and wield the Mjolnir..Taika Waititi on Thor Love and Thunder: ‘It’s crazier and far more emotional’"
60e91f09b925676bba4c19c1,"<p>In ""Thor: Ragnarok,"" among a longer list of deeds for which he seeks atonement, Loki admits that he regrets transforming his adoptive brother Thor (Chris Hemsworth) into a frog. Throg, then, may not have appeared on screen prior, but is nevertheless a ...</p>",The Alternate Thor Who Was Meant To Have A Bigger Role In Loki,"<p>In ""Thor: Ragnarok,"" among a longer list of deeds for which he seeks atonement, Loki admits that he regrets transforming his adoptive brother Thor (Chris Hemsworth) into a frog. Throg, then, may not have appeared on screen prior, but is nevertheless a ...</p>.The Alternate Thor Who Was Meant To Have A Bigger Role In Loki"
60e953daadeaa7780de02815,"<p>Natalie Portman will return to reprise her role as Jane Foster and take on the new role of female Thor. Aside from Portman and Chris Hemsworth, the cast includes Tessa Thompson, Christian Bale, Chriss Pratt, Dave Bautista, Vin Diesel, Karen Gillan ...</p>",12 upcoming superhero movies and TV shows that we can’t wait to watch after ‘Black Widow’,"<p>Natalie Portman will return to reprise her role as Jane Foster and take on the new role of female Thor. Aside from Portman and Chris Hemsworth, the cast includes Tessa Thompson, Christian Bale, Chriss Pratt, Dave Bautista, Vin Diesel, Karen Gillan ...</p>.12 upcoming superhero movies and TV shows that we can’t wait to watch after ‘Black Widow’"
60e96433adeaa7780de029cd,"<p>Other Marvel actors who are reportedly part of the voice cast of the animated series are Chris Hemsworth (Thor), Tom Hiddleston (Loki), Samuel L. Jackson (Nick Fury), Michael B. Jordan (Killmonger), Natalie Portman (Jane Foster), Paul Rudd (Scott Lang ...</p>",WATCH: Chadwick Boseman's last performance as T'Challa,"<p>Other Marvel actors who are reportedly part of the voice cast of the animated series are Chris Hemsworth (Thor), Tom Hiddleston (Loki), Samuel L. Jackson (Nick Fury), Michael B. Jordan (Killmonger), Natalie Portman (Jane Foster), Paul Rudd (Scott Lang ...</p>.WATCH: Chadwick Boseman's last performance as T'Challa"
60ea81d8adeaa7780de02c31,"Believe it or not, Chris Hemsworth appeared in the latest episode of Loki — you just may not have seen it. The Kate Herron-directed episode took fans of the show to a mystical place called The Void, a location at the end of time where all matter pruned by the Time Variance Authority was forced to live out its remaining days.",Chris Hemsworth Recorded Throg's Lines for Loki Episode 5,"Believe it or not, Chris Hemsworth appeared in the latest episode of Loki — you just may not have seen it. The Kate Herron-directed episode took fans of the show to a mystical place called The Void, a location at the end of time where all matter pruned by the Time Variance Authority was forced to live out its remaining days..Chris Hemsworth Recorded Throg's Lines for Loki Episode 5"
60ea81d8adeaa7780de02c32,"Note: This piece discusses spoilers for “Journey Into Mystery,” the fifth installment of Loki.] © Photo: Brook Mitchell () Chris Hemsworth . As far as cold-blood","Chris Hemsworth recorded brand new ""dialogue"" for Loki's Frog Thor cameo","Note: This piece discusses spoilers for “Journey Into Mystery,” the fifth installment of Loki.] © Photo: Brook Mitchell () Chris Hemsworth . As far as cold-blood.Chris Hemsworth recorded brand new ""dialogue"" for Loki's Frog Thor cameo"
