607f934545864a66fc104ade,"List of IAB Vendors Marvel star Chris Hemsworth has teased the upcoming Mad Max: Fury Road prequel Furiosa, admitting it has been a dream come true for him. The Thor actor is taking on a yet-to-be-disclosed role in the new movie,","Thor's Chris Hemsworth says Mad Max prequel role is ""biggest pinch-myself moment""","List of IAB Vendors Marvel star Chris Hemsworth has teased the upcoming Mad Max: Fury Road prequel Furiosa, admitting it has been a dream come true for him. The Thor actor is taking on a yet-to-be-disclosed role in the new movie,.Thor's Chris Hemsworth says Mad Max prequel role is ""biggest pinch-myself moment"""
607f909845864a66fc104acf,"Hollywood star Chris Hemsworth, who is set to star in the upcoming movie 'Furiosa', a prequel to 'Mad Max: Fury Road', said that filming the movie was his ""biggest pinch-myself moment.""According to People Magazine,",Chris Hemsworth is excited for filming 'Furiosa',"Hollywood star Chris Hemsworth, who is set to star in the upcoming movie 'Furiosa', a prequel to 'Mad Max: Fury Road', said that filming the movie was his ""biggest pinch-myself moment.""According to People Magazine,.Chris Hemsworth is excited for filming 'Furiosa'"
6080e0ca45864a66fc104cfa,"Whether it’s on a red carpet or in a caption on Instagram, Chris Hemsworth is always letting fans know just how much he loves his wife of more than a decade, Elsa Pataky. Now, he’s not only expressing his adoration for his partner,",Chris Hemsworth credits wife Elsa Pataky for his style evolution,"Whether it’s on a red carpet or in a caption on Instagram, Chris Hemsworth is always letting fans know just how much he loves his wife of more than a decade, Elsa Pataky. Now, he’s not only expressing his adoration for his partner,.Chris Hemsworth credits wife Elsa Pataky for his style evolution"
6080dbed45864a66fc104cdf,"And if it wasn’t clear before, it certainly would be now as the God of Thunder himself, Chris Hemsworth, has shared a pic on his Instagram account featuring him and Damon hanging out. The pair are seen catching the latest UFC Fight Night while on a break from filming in Australia.",Chris Hemsworth Shares Selfie With Matt Damon Watching UFC,"And if it wasn’t clear before, it certainly would be now as the God of Thunder himself, Chris Hemsworth, has shared a pic on his Instagram account featuring him and Damon hanging out. The pair are seen catching the latest UFC Fight Night while on a break from filming in Australia..Chris Hemsworth Shares Selfie With Matt Damon Watching UFC"
6082180e45864a66fc105086,"Not too long ago, Oscar-winner Russell Crowe was spotted with “Thor: Love & Thunder” director Taika Waititi and star Chris Hemsworth at a South Sydney Rabbitohs game via social media. That led to the announcement that Crowe would be joining the sequel in an undisclosed role.",Russell Crowe Reveals He’s Playing Zeus In ‘Thor: Love & Thunder’ Making Way For Olympians In The MCU,"Not too long ago, Oscar-winner Russell Crowe was spotted with “Thor: Love & Thunder” director Taika Waititi and star Chris Hemsworth at a South Sydney Rabbitohs game via social media. That led to the announcement that Crowe would be joining the sequel in an undisclosed role..Russell Crowe Reveals He’s Playing Zeus In ‘Thor: Love & Thunder’ Making Way For Olympians In The MCU"
60810e3a45864a66fc104e53,"Inside Chris, Liam and Luke Hemsworth's wild upbringing with their equally good-looking parents, Craig and Leonie.","Inside Chris, Liam and Luke Hemsworth's wild upbringing with their equally good-looking parents","Inside Chris, Liam and Luke Hemsworth's wild upbringing with their equally good-looking parents, Craig and Leonie..Inside Chris, Liam and Luke Hemsworth's wild upbringing with their equally good-looking parents"
6081086d45864a66fc104e08,Miley Cyrus mocks articles about her failed relationships and marriage to Liam Hemsworth while singing Kid Laroi's Without You in a new video on Instagram.,Miley Cyrus Sings 'Without You' And Mocks Articles About Her Failed Marriage With Liam,Miley Cyrus mocks articles about her failed relationships and marriage to Liam Hemsworth while singing Kid Laroi's Without You in a new video on Instagram..Miley Cyrus Sings 'Without You' And Mocks Articles About Her Failed Marriage With Liam
608108af45864a66fc104e0b,"On Wednesday, the Australian actor gave fans a rare glimpse into his home life by sharing a sweet video with his twin boys Tristan and Sasha, both seven, to Instagram. Family first: On Wednesday, Chris Hemsworth gave fans a rare glimpse into his home life by sharing a sweet video with his twin boys Tristan and Sasha,",Chris Hemsworth gives fans a rare glimpse into his home life,"On Wednesday, the Australian actor gave fans a rare glimpse into his home life by sharing a sweet video with his twin boys Tristan and Sasha, both seven, to Instagram. Family first: On Wednesday, Chris Hemsworth gave fans a rare glimpse into his home life by sharing a sweet video with his twin boys Tristan and Sasha,.Chris Hemsworth gives fans a rare glimpse into his home life"
6084eaf645864a66fc1056bd,The identities of celebrities like Chris Hemsworth and Nicole Kidman are being used as fronts for Bitcoin scams costing Australians millions of dollars.,Celebrities used in Bitcoin scam costing Australians millions,The identities of celebrities like Chris Hemsworth and Nicole Kidman are being used as fronts for Bitcoin scams costing Australians millions of dollars..Celebrities used in Bitcoin scam costing Australians millions
6084eaf645864a66fc1056be,The identities of celebrities like Chris Hemsworth and Nicole Kidman are being used as fronts for Bitcoin scams costing Australians millions of dollars.,Celebrities used in Bitcoin scam costing Australians millions,The identities of celebrities like Chris Hemsworth and Nicole Kidman are being used as fronts for Bitcoin scams costing Australians millions of dollars..Celebrities used in Bitcoin scam costing Australians millions
6084ea2b45864a66fc1056b5,Provided by Cover Media Chris Hemsworth . Chris Hemsworth has credited his wife Elsa Pataky for influencing his style transformation over the years. The 37-year-old Australian,Chris Hemsworth credits wife Elsa Pataky for style transformation,Provided by Cover Media Chris Hemsworth . Chris Hemsworth has credited his wife Elsa Pataky for influencing his style transformation over the years. The 37-year-old Australian.Chris Hemsworth credits wife Elsa Pataky for style transformation
6086324d45864a66fc105949,Chris Hemsworth and Elsa Pataky have been travelling between Sydney and Byron Bay while they both work on projects in the Harbour,Chris Hemsworth and Elsa Pataky take off in a helicopter from the Sydney ...,Chris Hemsworth and Elsa Pataky have been travelling between Sydney and Byron Bay while they both work on projects in the Harbour.Chris Hemsworth and Elsa Pataky take off in a helicopter from the Sydney ...
608693ab45864a66fc105b88,"Chris Hemsworth made the most of a day off from filming the upcoming Thor instalment, Love and Thunder. The 37-year-old actor was spotted enjoying a rare beer with his long-time best friend and personal assistant,",Chris Hemsworth enjoys a beer during a leisurely lunch with friends in Sydney's Bondi,"Chris Hemsworth made the most of a day off from filming the upcoming Thor instalment, Love and Thunder. The 37-year-old actor was spotted enjoying a rare beer with his long-time best friend and personal assistant,.Chris Hemsworth enjoys a beer during a leisurely lunch with friends in Sydney's Bondi"
6087a2a245864a66fc105e14,"Last year, a video that showed Miley Cyrus seemingly pushing her Aussie ex-hubby Liam Hemsworth off her on the red carpet while they were still together resurfaced and it was so bloody cringe. It showed our queen Miley pushing her man away to enjoy the ...",Another Vid Of Miley & Liam Being Tense As Fuck Pre-Divorce Has Resurfaced & I Can’t Unsee It,"Last year, a video that showed Miley Cyrus seemingly pushing her Aussie ex-hubby Liam Hemsworth off her on the red carpet while they were still together resurfaced and it was so bloody cringe. It showed our queen Miley pushing her man away to enjoy the ....Another Vid Of Miley & Liam Being Tense As Fuck Pre-Divorce Has Resurfaced & I Can’t Unsee It"
608788cd45864a66fc105d72,"Endgame"" are celebrating the 2nd anniversary of the hit film. This time in 2019, Jeremy Renner, Chris Evans, Robert Downey Jr., Chris Hemsworth, Scarlett Johansson and Mark Ruffalo marked the premiere in L.","Mark Ruffalo, Robert Downey Jr. And More Celebrate 2nd Anniversary Of ‘Avengers: Endgame’","Endgame"" are celebrating the 2nd anniversary of the hit film. This time in 2019, Jeremy Renner, Chris Evans, Robert Downey Jr., Chris Hemsworth, Scarlett Johansson and Mark Ruffalo marked the premiere in L..Mark Ruffalo, Robert Downey Jr. And More Celebrate 2nd Anniversary Of ‘Avengers: Endgame’"
608907e545864a66fc10639d,"An Unearthed red carpet footage from February 2019 shows tension between then-newlyweds Miley Cyrus and Liam Hemsworth. The Australian actor, in a viral video, looked visibly embarrassed by the 'Wrecking Ball' singer as she began twerking at a Vanity Fair Oscars after-party which was held just two weeks after the A-list couple's wedding.",Liam Hemsworth embarrassed by Miley Cyrus' twerking at a party months before their divorce,"An Unearthed red carpet footage from February 2019 shows tension between then-newlyweds Miley Cyrus and Liam Hemsworth. The Australian actor, in a viral video, looked visibly embarrassed by the 'Wrecking Ball' singer as she began twerking at a Vanity Fair Oscars after-party which was held just two weeks after the A-list couple's wedding..Liam Hemsworth embarrassed by Miley Cyrus' twerking at a party months before their divorce"
608a5c2f19484828b9061086,"Another unearthed red carpet video has shown just how tense things got between Miley Cyrus and Liam Hemsworth before their split. The April 2019 video, posted by Instagram user @popcultureangel, was taken just four months before the A-list couple announced they had separated.",Miley Cyrus pushes Liam Hemsworth away from her on the red carpet in ...,"Another unearthed red carpet video has shown just how tense things got between Miley Cyrus and Liam Hemsworth before their split. The April 2019 video, posted by Instagram user @popcultureangel, was taken just four months before the A-list couple announced they had separated..Miley Cyrus pushes Liam Hemsworth away from her on the red carpet in ..."
608a6afe19484828b9061127,A fan has unearthed a video from 2019 that appears to show tension in Miley Cyrus and Liam Hemsworth’s relationship months before news broke that they had split.,Liam Hemsworth Disses Miley Cyrus’ Twerking In Resurfaced Video From 6 Mos. Before Split,A fan has unearthed a video from 2019 that appears to show tension in Miley Cyrus and Liam Hemsworth’s relationship months before news broke that they had split..Liam Hemsworth Disses Miley Cyrus’ Twerking In Resurfaced Video From 6 Mos. Before Split
608a5dd819484828b90610a7,"Now, Cyrus' penchant for twerking and public audaciousness is hardly a surprise, but despite this, it looks as if it didn't always sit so well with her ex-husband, Liam Hemsworth. Earlier this week, a fan resurfaced a 2019 interview that saw the pair at the 2019 Vanity Fair Oscars party.",A Resurfaced Video Sees A *Very* Embarrassed Liam Hemsworth Telling Miley Cyrus To Stop Twerking,"Now, Cyrus' penchant for twerking and public audaciousness is hardly a surprise, but despite this, it looks as if it didn't always sit so well with her ex-husband, Liam Hemsworth. Earlier this week, a fan resurfaced a 2019 interview that saw the pair at the 2019 Vanity Fair Oscars party..A Resurfaced Video Sees A *Very* Embarrassed Liam Hemsworth Telling Miley Cyrus To Stop Twerking"
608a6c3419484828b906112e,"Thor: Love and Thunder really is bringing a lot of love and a lot of thunder to the Marvel sequel. Chris Hemsworth returns as the Norse god in Thor 4, though this time, he'll share the hammer (and power) with Natalie Portman.","Thor: Love and Thunder cast, set photos, release date, plot, villain and everything else we know","Thor: Love and Thunder really is bringing a lot of love and a lot of thunder to the Marvel sequel. Chris Hemsworth returns as the Norse god in Thor 4, though this time, he'll share the hammer (and power) with Natalie Portman..Thor: Love and Thunder cast, set photos, release date, plot, villain and everything else we know"
608f89cd19484828b9061717,"The Hemsworths know how to throw a party, sharing a series of snaps from a lavish all-white bash they held over the weekend for their celebrity pals. The Hemsworths’ Byron Bay mansion is the place to be.",Chris Hemsworth and Elsa Pataky throw all-white party with a host of A-listers,"The Hemsworths know how to throw a party, sharing a series of snaps from a lavish all-white bash they held over the weekend for their celebrity pals. The Hemsworths’ Byron Bay mansion is the place to be..Chris Hemsworth and Elsa Pataky throw all-white party with a host of A-listers"
6090f80619484828b9061b53,Fans across the globe have grown pretty jealous of Chris Hemsworth and Elsa Pataky's partying - especially as the Covid-19 pandemic rages around the world,Chris Hemsworth's fans fume with jealousy as he throws a 'white party' in Byron Bay,Fans across the globe have grown pretty jealous of Chris Hemsworth and Elsa Pataky's partying - especially as the Covid-19 pandemic rages around the world.Chris Hemsworth's fans fume with jealousy as he throws a 'white party' in Byron Bay
60913e5819484828b9061eba,"Chris Hemsworth and wife Elsa Pataky surely know how to throw a party. The couple was seen showing off their snazzy moves as they strutted by the pool side looking like the most fun party hosts. In a video shared by Elsa,","Watch: Chris Hemsworth, Elsa Pataky Show Off Their Dance Moves at Theme Party","Chris Hemsworth and wife Elsa Pataky surely know how to throw a party. The couple was seen showing off their snazzy moves as they strutted by the pool side looking like the most fun party hosts. In a video shared by Elsa,.Watch: Chris Hemsworth, Elsa Pataky Show Off Their Dance Moves at Theme Party"
60913e5919484828b9061eea,"Chris Hemsworth isn’t just Thor, he is Magic Mike in Thor’s body. The Aussie actor and his wife, Elsa Pataky showed off their smooth dance moves while hosting an all-white party in Australia. The Marvel star did not come to play with his dance moves and made sure to show out at the star-studded event.",Check Out Chris Hemsworth Bursting Out a Twerk Session in This Hilarious Video,"Chris Hemsworth isn’t just Thor, he is Magic Mike in Thor’s body. The Aussie actor and his wife, Elsa Pataky showed off their smooth dance moves while hosting an all-white party in Australia. The Marvel star did not come to play with his dance moves and made sure to show out at the star-studded event..Check Out Chris Hemsworth Bursting Out a Twerk Session in This Hilarious Video"
60913e5919484828b9061ef0,A video of Chris Hemsworth dancing to Bee Gees' Stayin' Alive with his wife Elsa has gone viral on social media. The Internet called them couple goals.,Chris Hemsworth dances to Bee Gees' Stayin' Alive with wife in viral video. Watch,A video of Chris Hemsworth dancing to Bee Gees' Stayin' Alive with his wife Elsa has gone viral on social media. The Internet called them couple goals..Chris Hemsworth dances to Bee Gees' Stayin' Alive with wife in viral video. Watch
6091706f19484828b9061f83,"The Hemsworths know how to party. Chris Hemsworth and his wife Elsa Pataky attended an epic white-themed party on Sunday, with Pataky sharing some snaps from the bash on Instagram. She also posted an incredible video of Chris showing off his impressive dance moves while wearing a pair of white flares,","Chris Hemsworth Shows Off His Epic Dance Moves At White-Themed Party Attended By Elsa Pataky, Matt Damon & More","The Hemsworths know how to party. Chris Hemsworth and his wife Elsa Pataky attended an epic white-themed party on Sunday, with Pataky sharing some snaps from the bash on Instagram. She also posted an incredible video of Chris showing off his impressive dance moves while wearing a pair of white flares,.Chris Hemsworth Shows Off His Epic Dance Moves At White-Themed Party Attended By Elsa Pataky, Matt Damon & More"
6092584b4325e9120c1dde36,<p>It's hard to believe that Chris Hemsworth and Elsa Pataky have already crossed a decade (and counting!) in their marriage as it still feels like</p>,VIDEO: Chris Hemsworth and Elsa Pataky SUIT UP in white and party showing off their wicked dance moves,<p>It's hard to believe that Chris Hemsworth and Elsa Pataky have already crossed a decade (and counting!) in their marriage as it still feels like</p>.VIDEO: Chris Hemsworth and Elsa Pataky SUIT UP in white and party showing off their wicked dance moves
609261074325e9120c1ddef2,"Director Taika Waititi on Chris Hemsworth starrer 'Thor: Love and Thunder' - Taika Waititi was pleased to work with Chris Hemsworth, says, he has all the qualities of a superhero.",'It might be the best Marvel film ever': Director Taika Waititi on Chris Hemsworth starrer 'Thor: Love and Thunder',"Director Taika Waititi on Chris Hemsworth starrer 'Thor: Love and Thunder' - Taika Waititi was pleased to work with Chris Hemsworth, says, he has all the qualities of a superhero..'It might be the best Marvel film ever': Director Taika Waititi on Chris Hemsworth starrer 'Thor: Love and Thunder'"
6092624f4325e9120c1ddf28,"Starring Chris Hemsworth, Natalie Portman and Russell Crowe, Thor: Love and Thunder will release in May next year.",Taika Waititi on Thor Love and Thunder: ‘It might be the best Marvel film ever’,"Starring Chris Hemsworth, Natalie Portman and Russell Crowe, Thor: Love and Thunder will release in May next year..Taika Waititi on Thor Love and Thunder: ‘It might be the best Marvel film ever’"
60938f464325e9120c1de537,"There must be something seriously wrong with you if you don’t like Chris Hemsworth. Apart from being a proper style icon, he is also a gem of a human being and an extremely talented actor. Heck, one can actually argue,",Chris Hemsworth ‘Humbled’ After Seeing Massive Sea Of Football Fans ‘Worshipping’ His Billboard,"There must be something seriously wrong with you if you don’t like Chris Hemsworth. Apart from being a proper style icon, he is also a gem of a human being and an extremely talented actor. Heck, one can actually argue,.Chris Hemsworth ‘Humbled’ After Seeing Massive Sea Of Football Fans ‘Worshipping’ His Billboard"
6094c8524325e9120c1df163,"Is engagement on the cards for Liam Hemsworth and Gabriella Brooks? According to Us Weekly, the 31-year-old Aussie actor is ""ready to be husband"" again ""Liam and Gabriella have been getting serious,"" a source told the outlet.","Liam Hemsworth 'ready to be a husband' to Gabriella Brooks, engagement could be 'right around the corner'","Is engagement on the cards for Liam Hemsworth and Gabriella Brooks? According to Us Weekly, the 31-year-old Aussie actor is ""ready to be husband"" again ""Liam and Gabriella have been getting serious,"" a source told the outlet..Liam Hemsworth 'ready to be a husband' to Gabriella Brooks, engagement could be 'right around the corner'"
6094c8524325e9120c1df162,Liam Hemsworth is “ready to be a husband” again after his short-lived marriage to Hollywood singer Miley Cyrus.,Liam Hemsworth Could Propose To Girlfriend Gabriella Brooks Anytime Soon: Report,Liam Hemsworth is “ready to be a husband” again after his short-lived marriage to Hollywood singer Miley Cyrus..Liam Hemsworth Could Propose To Girlfriend Gabriella Brooks Anytime Soon: Report
6094ee004325e9120c1df49c,"Liam Hemsworth could be set to propose to Gabriella Brooks.The 31-year-old actor has been romancing Gabriella since December 2019, and sources have now claimed they could be set to take their romance to the next level,","Liam Hemsworth getting serious with girlfriend, set to propose","Liam Hemsworth could be set to propose to Gabriella Brooks.The 31-year-old actor has been romancing Gabriella since December 2019, and sources have now claimed they could be set to take their romance to the next level,.Liam Hemsworth getting serious with girlfriend, set to propose"
6097fc5ecbb3cc0d80f7342d,"It appears when you invite a Hemsworth to your party, an entire village of shiny, perfect, rich people turn up.",The Hemsworths hit peak Byron Bay with their White Party,"It appears when you invite a Hemsworth to your party, an entire village of shiny, perfect, rich people turn up..The Hemsworths hit peak Byron Bay with their White Party"
6098c840cbb3cc0d80f73ccc,"Longtime Thor actor Chris Hemsworth and wife Elsa Pataky have three young children together, including a set of twins. Their twins came under two years after the birth of their first born, which means they had 3 under 2 at one time.",Thor: Love And Thunder’s Chris Hemsworth Celebrates Mother’s Day With Sweet Tribute To Wife Elsa Pataky,"Longtime Thor actor Chris Hemsworth and wife Elsa Pataky have three young children together, including a set of twins. Their twins came under two years after the birth of their first born, which means they had 3 under 2 at one time..Thor: Love And Thunder’s Chris Hemsworth Celebrates Mother’s Day With Sweet Tribute To Wife Elsa Pataky"
6098d16ccbb3cc0d80f73e0b,Thor: Love and Thunder actor Chris Hemsworth shared a throwback of wife Elsa Pataky holding their three kids for a sweet Mother's Day tribute,Chris Hemsworth Praises 'Bar Raising' Wife Elsa Pataky on Mother's Day: 'We Salute You',Thor: Love and Thunder actor Chris Hemsworth shared a throwback of wife Elsa Pataky holding their three kids for a sweet Mother's Day tribute.Chris Hemsworth Praises 'Bar Raising' Wife Elsa Pataky on Mother's Day: 'We Salute You'
609947b5cbb3cc0d80f746b5,"Elsa Pataky and Chris Hemsworth are without a doubt the most famous couple to live in Byron Bay. Celine Dion says being a mom is 'a privilege' as she poses with her three sons in sweet Mother's Day photo And on Monday,",Is Elsa Pataky moving her entire family to Byron Bay?,"Elsa Pataky and Chris Hemsworth are without a doubt the most famous couple to live in Byron Bay. Celine Dion says being a mom is 'a privilege' as she poses with her three sons in sweet Mother's Day photo And on Monday,.Is Elsa Pataky moving her entire family to Byron Bay?"
609a3723cbb3cc0d80f755bc,"Elsa Pataky and Chris Hemsworth are without a doubt the most famous couple to live in Byron Bay. Celine Dion says being a mom is 'a privilege' as she poses with her three sons in sweet Mother's Day photo And on Monday,",Is Elsa Pataky moving her entire family to Byron Bay?,"Elsa Pataky and Chris Hemsworth are without a doubt the most famous couple to live in Byron Bay. Celine Dion says being a mom is 'a privilege' as she poses with her three sons in sweet Mother's Day photo And on Monday,.Is Elsa Pataky moving her entire family to Byron Bay?"
609a44e2cbb3cc0d80f75776,Insider Daniel Richtman claims that the tortured Masters of the Universe reboot wants Chris Hemsworth as He-Man.,Chris Hemsworth Reportedly Eyed For He-Man In Masters Of The Universe Movie,Insider Daniel Richtman claims that the tortured Masters of the Universe reboot wants Chris Hemsworth as He-Man..Chris Hemsworth Reportedly Eyed For He-Man In Masters Of The Universe Movie
609cab26cbb3cc0d80f76e5f,"Miley Cyrus and Liam Hemsworth may no longer be together, but the singer still has fond memories of their past relationship. On Wednesday, Cyrus took to Instagram to celebrate the fourth anniversary of her song “Malibu,",Miley Cyrus Reflects On Loving Liam Hemsworth ‘Very Much’ In ‘Malibu’ Anniversary Tribute,"Miley Cyrus and Liam Hemsworth may no longer be together, but the singer still has fond memories of their past relationship. On Wednesday, Cyrus took to Instagram to celebrate the fourth anniversary of her song “Malibu,.Miley Cyrus Reflects On Loving Liam Hemsworth ‘Very Much’ In ‘Malibu’ Anniversary Tribute"
609cab26cbb3cc0d80f76e5d,Miley Cyrus looked back at her relationship with Liam Hemsworth on the four-year anniversary of 'Malibu' — all the details,Miley Cyrus Reflects on Writing ‘Malibu’ About Liam Hemsworth: ‘A Person I Loved Very Much’,Miley Cyrus looked back at her relationship with Liam Hemsworth on the four-year anniversary of 'Malibu' — all the details.Miley Cyrus Reflects on Writing ‘Malibu’ About Liam Hemsworth: ‘A Person I Loved Very Much’
609cab25cbb3cc0d80f76e5a,"Miley Cyrus, 28, reflects on her relationship with Liam Hemsworth as she celebrates the four year anniversary of her song Malibu with a heartfelt caption and video of her recording the song",Miley Cyrus touches on her relationship with Liam Hemsworth as she talks anniversary of song Malibu,"Miley Cyrus, 28, reflects on her relationship with Liam Hemsworth as she celebrates the four year anniversary of her song Malibu with a heartfelt caption and video of her recording the song.Miley Cyrus touches on her relationship with Liam Hemsworth as she talks anniversary of song Malibu"
609cab25cbb3cc0d80f76e5b,Miley Cyrus and Liam Hemsworth had an on-and-off relationship since meeting in 2009 but finally split for good in 2019,Miley Cyrus reflects on Liam Hemsworth romance as she pays tribute to home they lost in wildfires,Miley Cyrus and Liam Hemsworth had an on-and-off relationship since meeting in 2009 but finally split for good in 2019.Miley Cyrus reflects on Liam Hemsworth romance as she pays tribute to home they lost in wildfires
