60f4e196d841032be562d9b8,"Hollywood actor Chris Hemsworth and Elsa Pataky are now married for more than 10 years. The couple has been giving major marriage goals and keep sharing amazing photographs from their daily lives. They never fail to amaze us with their romantic moments as well as the moments with their children- daughter India,",Chris Hemsworth Wishes Wife Elsa Pataky On Her Birthday In An Adorable Way; See Pics,"Hollywood actor Chris Hemsworth and Elsa Pataky are now married for more than 10 years. The couple has been giving major marriage goals and keep sharing amazing photographs from their daily lives. They never fail to amaze us with their romantic moments as well as the moments with their children- daughter India,.Chris Hemsworth Wishes Wife Elsa Pataky On Her Birthday In An Adorable Way; See Pics"
60f53e2ad841032be562debc,"Spanish actress Elsa Pataky turned 45 on Sunday and her husband, Chris Hemsworth, sent a warm message to her on Instagram. The Australian actor published a series of photos to ce",Chris Hemsworth's warm birthday wish for Elsa Pataky,"Spanish actress Elsa Pataky turned 45 on Sunday and her husband, Chris Hemsworth, sent a warm message to her on Instagram. The Australian actor published a series of photos to ce.Chris Hemsworth's warm birthday wish for Elsa Pataky"
60f53e1fd841032be562debb,"Chris Hemsworth found a sentimental way to honor Elsa Pataky on her special day. The Thor: Love and Thunder actor, 37, shared a simple yet sweet message for his wife of ten years on Saturday in honor of the actress' milestone 45th birthday.","Chris Hemsworth Celebrates Wife Elsa Pataky's 45th Birthday with Sweet, Sentimental Photos","Chris Hemsworth found a sentimental way to honor Elsa Pataky on her special day. The Thor: Love and Thunder actor, 37, shared a simple yet sweet message for his wife of ten years on Saturday in honor of the actress' milestone 45th birthday..Chris Hemsworth Celebrates Wife Elsa Pataky's 45th Birthday with Sweet, Sentimental Photos"
60f54d28d841032be562df7f,"One of the sweetest couples in Hollywood, Elsa Pataky and Chris Hemsworth, are always sharing great moments on their IG posts. This Sunday, the 37-year-old actor paid tribute to Pataky - who is celebrating her 45th birthday.",Don’t miss! Elsa Pataky’s sweet birthday tribute from hubby Chris Hemsworth,"One of the sweetest couples in Hollywood, Elsa Pataky and Chris Hemsworth, are always sharing great moments on their IG posts. This Sunday, the 37-year-old actor paid tribute to Pataky - who is celebrating her 45th birthday..Don’t miss! Elsa Pataky’s sweet birthday tribute from hubby Chris Hemsworth"
60f54e32d841032be562df8d,"Chris Hemsworth is known for having one of the best physiques in the business. So it's no surprise that the Australian hunk enjoys a high protein diet when snacking.  On Saturday, the 37-year-old actor left some unsuspecting fast food workers feeling starstruck following a drive-through visit at a northern NSW KFC restaurant.",Fast food run! Chris Hemsworth surprises fans with a drive-through visit at KFC,"Chris Hemsworth is known for having one of the best physiques in the business. So it's no surprise that the Australian hunk enjoys a high protein diet when snacking.  On Saturday, the 37-year-old actor left some unsuspecting fast food workers feeling starstruck following a drive-through visit at a northern NSW KFC restaurant..Fast food run! Chris Hemsworth surprises fans with a drive-through visit at KFC"
60f54cd7d841032be562df2c,"He works with the one-and-only Chris Hemsworth, so naturally Body+Soul had to investigate trainer Da Rulk’s key tips to build that bod.",Chris Hemsworth’s trainer on smashing fitness goals,"He works with the one-and-only Chris Hemsworth, so naturally Body+Soul had to investigate trainer Da Rulk’s key tips to build that bod..Chris Hemsworth’s trainer on smashing fitness goals"
60f54cd7d841032be562df2b,"Chris Hemsworth was enjoying a day off on Saturday. The actor, 37, headed out to the small gown of Bangalow in Byron Bay Shire, with his twin sons, Tristan and Sasha, both seven. The Thor star dressed down in a navy blue,",Chris Hemsworth enjoys a relaxing day out with his twin sons in the Byron Bay town of Bangalow,"Chris Hemsworth was enjoying a day off on Saturday. The actor, 37, headed out to the small gown of Bangalow in Byron Bay Shire, with his twin sons, Tristan and Sasha, both seven. The Thor star dressed down in a navy blue,.Chris Hemsworth enjoys a relaxing day out with his twin sons in the Byron Bay town of Bangalow"
60f64849d841032be562e440,"Chris Hemsworth is known for having one of the best physiques in the business.So it's no surprise that the Australian hunk enjoys a high protein diet when snacking. On Saturday, the 37-year-old actor left some unsuspecting fast food workers feeling starstruck following a drive-through visit at a northern NSW KFC restaurant.",Chris Hemsworth surprises fans with a drive-through visit at KFC,"Chris Hemsworth is known for having one of the best physiques in the business.So it's no surprise that the Australian hunk enjoys a high protein diet when snacking. On Saturday, the 37-year-old actor left some unsuspecting fast food workers feeling starstruck following a drive-through visit at a northern NSW KFC restaurant..Chris Hemsworth surprises fans with a drive-through visit at KFC"
60f64849d841032be562e43e,"Chris Hemsworth was enjoying a day off on Saturday. The actor, 37, headed out to the small town of Bangalow in Byron Shire, with his twin sons, Tristan and Sasha, both seven.  The Thor star dressed down in a navy blue,",Chris Hemsworth enjoys a day out with his twin sons in the Byron Bay,"Chris Hemsworth was enjoying a day off on Saturday. The actor, 37, headed out to the small town of Bangalow in Byron Shire, with his twin sons, Tristan and Sasha, both seven.  The Thor star dressed down in a navy blue,.Chris Hemsworth enjoys a day out with his twin sons in the Byron Bay"
60f694fdd841032be562e68e,"""Happy birthday gorgeous,"" he captioned the post, adding a red heart emoji. Chris Hemsworth`s post has left fans in awe of the couple`s bonding.",Chris Hemsworth`s birthday wish for wife Elsa Pataky is adorable,"""Happy birthday gorgeous,"" he captioned the post, adding a red heart emoji. Chris Hemsworth`s post has left fans in awe of the couple`s bonding..Chris Hemsworth`s birthday wish for wife Elsa Pataky is adorable"
60f7b328d841032be562edfd,"He may be known as the God of Thunder but away from the Marvel universe, Chris Hemsworth has proved he’s as down to earth as the rest of us.",Chris Hemsworth snaps selfie with fans at northern NSW KFC,"He may be known as the God of Thunder but away from the Marvel universe, Chris Hemsworth has proved he’s as down to earth as the rest of us..Chris Hemsworth snaps selfie with fans at northern NSW KFC"
60f8d49ed335da6e8fbc1ea9,"Workers at an Australian KFC got a surprise visit from Thor actor Chris Hemsworth, who stopped by a New South Wales drive-thru to order himself 15 original chicken pieces, a regular size Singer combo,",Chris Hemsworth prepares to play Hulk Hogan with $72 worth of KFC,"Workers at an Australian KFC got a surprise visit from Thor actor Chris Hemsworth, who stopped by a New South Wales drive-thru to order himself 15 original chicken pieces, a regular size Singer combo,.Chris Hemsworth prepares to play Hulk Hogan with $72 worth of KFC"
60fa807dd335da6e8fbc2a2d,"<p>The Jonas Brothers are challenging the Hemsworth brothers to a UFC Match. On The Tonight Show with Jimmy Fallon, the three musicians were in a joking mood. They’re trying to hype their Olympic Dreams special on NBC and laughed about their athletic achievements.</p>",The Jonas Brothers Just Challenged the Hemsworths to a Fight,"<p>The Jonas Brothers are challenging the Hemsworth brothers to a UFC Match. On The Tonight Show with Jimmy Fallon, the three musicians were in a joking mood. They’re trying to hype their Olympic Dreams special on NBC and laughed about their athletic achievements.</p>.The Jonas Brothers Just Challenged the Hemsworths to a Fight"
60fa94e1d335da6e8fbc2c7c,<p>Chris’ bicep alone is roughly equivalent in ... and the victors can take on the winners of the Jonas/Hemsworth bout.</p>,The Jonas Brothers Challenge The Hemsworths To A UFC Fight,<p>Chris’ bicep alone is roughly equivalent in ... and the victors can take on the winners of the Jonas/Hemsworth bout.</p>.The Jonas Brothers Challenge The Hemsworths To A UFC Fight
60fbebf78884795e38d4260d,Chris Hemsworth seeks to understand the reason behind the increase in local shark attacks and the different species and behaviors of sharks.,Watch Shark Beach with Chris Hemsworth,Chris Hemsworth seeks to understand the reason behind the increase in local shark attacks and the different species and behaviors of sharks..Watch Shark Beach with Chris Hemsworth
60fe74328884795e38d436b5,<p>What If?' is late actor Chadwick Boseman's final role and it also stars Hollywood royalty such as Chris Hemsworth and Josh Brolin</p>,"'What If ?': Release date, spoilers and all about Marvel's animated series on Disney+","<p>What If?' is late actor Chadwick Boseman's final role and it also stars Hollywood royalty such as Chris Hemsworth and Josh Brolin</p>.'What If ?': Release date, spoilers and all about Marvel's animated series on Disney+"
60ffb87d8884795e38d43cd2,"Sam Hargrave, who directed the 2020 Chris Hemsworth movie Extraction and served as the second unit director and stunt coorindator on a number of high profile action movies, including Avengers: Endgame,",Star Wars: Legendary Filmmaker Reportedly Worked on The Book of Boba Fett,"Sam Hargrave, who directed the 2020 Chris Hemsworth movie Extraction and served as the second unit director and stunt coorindator on a number of high profile action movies, including Avengers: Endgame,.Star Wars: Legendary Filmmaker Reportedly Worked on The Book of Boba Fett"
61016dea8884795e38d448df,"<p>And Chris Hemsworth had all eyes on him as he stepped out with his twin sons Sasha and Tristan, seven, in Byron Bay on Tuesday. The Hollywood actor, 37, showed off his muscular physique in a tight brown T-shirt as he visited his local shops.</p>",Chris Hemsworth displays his bulging biceps in a tight T-shirt while shopping ...,"<p>And Chris Hemsworth had all eyes on him as he stepped out with his twin sons Sasha and Tristan, seven, in Byron Bay on Tuesday. The Hollywood actor, 37, showed off his muscular physique in a tight brown T-shirt as he visited his local shops.</p>.Chris Hemsworth displays his bulging biceps in a tight T-shirt while shopping ..."
61016f6f8884795e38d448ec,"One of Byron’s star-studded families seems to have taken a liking to the new pump track in Suffolk Park. Chris Hemsworth has shared a gorgeous video of himself running alongside one of his children, who is riding a skateboard,",Chris Hemsworth has taken advantage of his new local pump track as part of the ‘ultimate family workout’,"One of Byron’s star-studded families seems to have taken a liking to the new pump track in Suffolk Park. Chris Hemsworth has shared a gorgeous video of himself running alongside one of his children, who is riding a skateboard,.Chris Hemsworth has taken advantage of his new local pump track as part of the ‘ultimate family workout’"
61016de38884795e38d448de,"<p>His&nbsp;good looks have gained him a legion of fans across the globe.And&nbsp;Chris Hemsworth had all eyes on him as he stepped out with his twin sons&nbsp;Sasha and Tristan, seven, in Byron Bay on Tuesday.The Hollywood actor,</p>",Chris Hemsworth displays his biceps in a tight T-shirt while shopping,"<p>His&nbsp;good looks have gained him a legion of fans across the globe.And&nbsp;Chris Hemsworth had all eyes on him as he stepped out with his twin sons&nbsp;Sasha and Tristan, seven, in Byron Bay on Tuesday.The Hollywood actor,</p>.Chris Hemsworth displays his biceps in a tight T-shirt while shopping"
61016df08884795e38d448e0,"<p>And Chris Hemsworth had all eyes on him as he stepped out with his twin sons Sasha and Tristan, seven, in Byron Bay on Tuesday. The Hollywood actor, 37, showed off his muscular physique in a tight brown T-shirt as he visited his local shops.</p>",Chris Hemsworth displays his bulging biceps in a tight T-shirt while shopping in Byron Bay,"<p>And Chris Hemsworth had all eyes on him as he stepped out with his twin sons Sasha and Tristan, seven, in Byron Bay on Tuesday. The Hollywood actor, 37, showed off his muscular physique in a tight brown T-shirt as he visited his local shops.</p>.Chris Hemsworth displays his bulging biceps in a tight T-shirt while shopping in Byron Bay"
6101790b8884795e38d44993,"Throg a variant of Chris Hemsworth’s Thor met us in episode 5 of Loki. Turns out, he now has a bigger part to play in season 2. Read on.",Loki 2: Chris Hemsworth Is Coming Back As Frog Thor aka Throg To Play A Pivotal Part?,"Throg a variant of Chris Hemsworth’s Thor met us in episode 5 of Loki. Turns out, he now has a bigger part to play in season 2. Read on..Loki 2: Chris Hemsworth Is Coming Back As Frog Thor aka Throg To Play A Pivotal Part?"
61016f6f8884795e38d448ea,Chris Hemsworth took to Instagram to share videos of him and Elsa Pataky helping their daughter India skateboard in the park and ride a horse. The post proves why the couple is goals.,Chris Hemsworth and wife Elsa Pataky's videos with daughter India prove they are goals: Watch,Chris Hemsworth took to Instagram to share videos of him and Elsa Pataky helping their daughter India skateboard in the park and ride a horse. The post proves why the couple is goals..Chris Hemsworth and wife Elsa Pataky's videos with daughter India prove they are goals: Watch
61016f6f8884795e38d448ed,"Hollywood star Chris Hemsworth and his wife Elsa Pataky, who are parents to daughter India Rose, and twin sons, Tristan and Sasha, are making sure to add elements of fun to their family workout.","Chris Hemsworth's family workout includes skating, horse-riding","Hollywood star Chris Hemsworth and his wife Elsa Pataky, who are parents to daughter India Rose, and twin sons, Tristan and Sasha, are making sure to add elements of fun to their family workout..Chris Hemsworth's family workout includes skating, horse-riding"
61016e468884795e38d448e1,<p>Chris Hemsworth took some time out of his busy schedule to spend time with his eight-year-old daughter India Rose on Wednesday.</p>,"Chris Hemsworth takes his daughter India, eight, to the skate park","<p>Chris Hemsworth took some time out of his busy schedule to spend time with his eight-year-old daughter India Rose on Wednesday.</p>.Chris Hemsworth takes his daughter India, eight, to the skate park"
61016f6f8884795e38d448eb,Chris Hemsworth took some time out of his busy schedule to spend time with his eight-year-old daughter India Rose on,Chris Hemsworth covers up his bulging biceps as he takes his daughter India to ...,Chris Hemsworth took some time out of his busy schedule to spend time with his eight-year-old daughter India Rose on.Chris Hemsworth covers up his bulging biceps as he takes his daughter India to ...
61016f6f8884795e38d448e9,"Hollywood actor Chris Hemsworth recently launched a fitness app where he, along with his team of trainers, launched a series of intense workout routines.","Chris Hemsworth and Wife Elsa Pataky's Family Workout Includes Horse-riding, Skating","Hollywood actor Chris Hemsworth recently launched a fitness app where he, along with his team of trainers, launched a series of intense workout routines..Chris Hemsworth and Wife Elsa Pataky's Family Workout Includes Horse-riding, Skating"
610229388884795e38d44ba0,"<p>Mention the idea of a family workout and you'll likely be hit with eye rolls, silence or an outright 'no way'. But Chris Hemsworth and wife Elsa Pataky may just have come up with a way to get fit, without anyone feeling like they're exercising.</p>",Chris Hemsworth shares 'ultimate family workout' in adorable daddy-daughter clip,"<p>Mention the idea of a family workout and you'll likely be hit with eye rolls, silence or an outright 'no way'. But Chris Hemsworth and wife Elsa Pataky may just have come up with a way to get fit, without anyone feeling like they're exercising.</p>.Chris Hemsworth shares 'ultimate family workout' in adorable daddy-daughter clip"
6102296c8884795e38d44ba1,"Chris Hemsworth has shared the secret to achieving his enviable physique, which apparently involves a child, a skateboard, a horse and ""a can do attitude."" That's according to an Instagram post that the ""Avengers"" star shared on Tuesday,","Chris Hemsworth Demonstrates His ‘Ultimate Family Workout’ Consisting Of A Horse, A Skateboard & ‘A Can Do Attitude’","Chris Hemsworth has shared the secret to achieving his enviable physique, which apparently involves a child, a skateboard, a horse and ""a can do attitude."" That's according to an Instagram post that the ""Avengers"" star shared on Tuesday,.Chris Hemsworth Demonstrates His ‘Ultimate Family Workout’ Consisting Of A Horse, A Skateboard & ‘A Can Do Attitude’"
6102296c8884795e38d44ba2,"In a video on Instagram, Chris Hemsworth shared his genius skateboard workout with his daughter and it looks like a blast.",Chris Hemsworth Shared A Video Of His “Ultimate Family Workout”,"In a video on Instagram, Chris Hemsworth shared his genius skateboard workout with his daughter and it looks like a blast..Chris Hemsworth Shared A Video Of His “Ultimate Family Workout”"
610229308884795e38d44b9f,"<p>In a new Instagram video, Chris Hemsworth proved workouts can be a family affair even outside the gym. Prepare to swoon with his latest father-daughter moment.</p>",Chris Hemsworth Proves He's the Ultimate Girl Dad During Must-See Family Workout,"<p>In a new Instagram video, Chris Hemsworth proved workouts can be a family affair even outside the gym. Prepare to swoon with his latest father-daughter moment.</p>.Chris Hemsworth Proves He's the Ultimate Girl Dad During Must-See Family Workout"
61025b108884795e38d44d06,"Chris Hemsworth and his wife Elsa Pataky are keeping their family fit! On Tuesday, the 37-year-old “Thor” actor shared videos of his family’s workout routines. “My wife and I designed the ultimate family workout.",Chris Hemsworth Holds Hands With 9-Year-Old Daughter India As She Skateboards In ‘Ultimate Family Workout’,"Chris Hemsworth and his wife Elsa Pataky are keeping their family fit! On Tuesday, the 37-year-old “Thor” actor shared videos of his family’s workout routines. “My wife and I designed the ultimate family workout..Chris Hemsworth Holds Hands With 9-Year-Old Daughter India As She Skateboards In ‘Ultimate Family Workout’"
6102712b8884795e38d44e4b,But Chris Hemsworth revealed there's something even he can't do. A friend of the actor posted a candid video of the 37-year-old Thor star's awful singing this week.   The former soap star was belting out the theme song from the show that made him famous: Home and Away.,Chris Hemsworth shows off awful singing skills as he plays Home and Away theme song on guitar,But Chris Hemsworth revealed there's something even he can't do. A friend of the actor posted a candid video of the 37-year-old Thor star's awful singing this week.   The former soap star was belting out the theme song from the show that made him famous: Home and Away..Chris Hemsworth shows off awful singing skills as he plays Home and Away theme song on guitar
6102736e8884795e38d44e63,"Thor: Love And Thunder stars Chris Hemsworth and is directed by Taika Waititi. Now, Matt Damon enters the team. Details inside!","Thor – Love And Thunder: Matt Damon Confirms Playing Fake Loki In Chris Hemsworth Starrer; Says, “Taika Waititi Had Us Back”","Thor: Love And Thunder stars Chris Hemsworth and is directed by Taika Waititi. Now, Matt Damon enters the team. Details inside!.Thor – Love And Thunder: Matt Damon Confirms Playing Fake Loki In Chris Hemsworth Starrer; Says, “Taika Waititi Had Us Back”"
610273da8884795e38d44e6f,"<p>Chris Hemsworth joked that the sweet moment is all part of his and wife Elsa Pataky's ""ultimate family workout"" with their three kids</p>",Watch Chris Hemsworth Demonstrate the 'Ultimate Workout' Alongside 9-Year-Old Daughter India,"<p>Chris Hemsworth joked that the sweet moment is all part of his and wife Elsa Pataky's ""ultimate family workout"" with their three kids</p>.Watch Chris Hemsworth Demonstrate the 'Ultimate Workout' Alongside 9-Year-Old Daughter India"
61028ec98884795e38d44fd9,"Hollywood actor Chris Hemsworth aka Marvel's Thor recently took to his Instagram and shared an interesting workout routine with wife Elsa Pataky, have a look.",Chris Hemsworth And Wife Elsa Pataky Share Their Fascinating Workout Regime; WATCH,"Hollywood actor Chris Hemsworth aka Marvel's Thor recently took to his Instagram and shared an interesting workout routine with wife Elsa Pataky, have a look..Chris Hemsworth And Wife Elsa Pataky Share Their Fascinating Workout Regime; WATCH"
61028ec98884795e38d44fda,"Hemsworth’s childhood friend and personal trainer Luke Zocchi — pictured above on the right of Hemsworth, while on his left is his stunt double — is a fitness expert with roots in boxing, and has joined us at HYPEBEAST to speak about his experience with Thor himself,",Chris Hemsworth’s Personal Trainer Luke Zocchi Tells Us How We Can Train Like Thor,"Hemsworth’s childhood friend and personal trainer Luke Zocchi — pictured above on the right of Hemsworth, while on his left is his stunt double — is a fitness expert with roots in boxing, and has joined us at HYPEBEAST to speak about his experience with Thor himself,.Chris Hemsworth’s Personal Trainer Luke Zocchi Tells Us How We Can Train Like Thor"
6102d2a3a12afb207a7374bb,"Chris Hemsworth and Elsa Pataky are the epitomai of parent goals! For the unversed, the criminally good-looking couple are blessed with three","VIDEO: Chris Hemsworth and Elsa Pataky design the 'ultimate family workout'; Plus, it's Ryan Reynolds APPROVED","Chris Hemsworth and Elsa Pataky are the epitomai of parent goals! For the unversed, the criminally good-looking couple are blessed with three.VIDEO: Chris Hemsworth and Elsa Pataky design the 'ultimate family workout'; Plus, it's Ryan Reynolds APPROVED"
6102d33ca12afb207a7374bf,"Starfleet captain, cult leader, secret agent, and, most famously, the literal God of Thunder. And every time he appears on screen, we can’t help but want more of him. Since it’s so important to stay up to date on All Things Chris Hemsworth,",Upcoming Chris Hemsworth to Keep on Your Radar,"Starfleet captain, cult leader, secret agent, and, most famously, the literal God of Thunder. And every time he appears on screen, we can’t help but want more of him. Since it’s so important to stay up to date on All Things Chris Hemsworth,.Upcoming Chris Hemsworth to Keep on Your Radar"
610378f1a12afb207a7375b6,"<p>Staying active is a family affair for superhero actor Chris Hemsworth and his supermodel wife Elsa Pataky. On Tuesday, the Thor star posted a couple of videos on Instagram showing the couple and their three children doing what he deemed the “ultimate family workout” — and we’re impressed!</p>",Chris Hemsworth Just Showed Off the ‘Ultimate Workout’ He Does With His Kids and We’re Impressed,"<p>Staying active is a family affair for superhero actor Chris Hemsworth and his supermodel wife Elsa Pataky. On Tuesday, the Thor star posted a couple of videos on Instagram showing the couple and their three children doing what he deemed the “ultimate family workout” — and we’re impressed!</p>.Chris Hemsworth Just Showed Off the ‘Ultimate Workout’ He Does With His Kids and We’re Impressed"
610378f8a12afb207a7375b7,"<p>Chris Hemsworth spends hours in the gym to get into Thor shape, but when he's off the clock, he relies on his family for a workout.</p>","Chris Hemsworth Shares His ""Ultimate Family Workout"" in Hilarious New Video","<p>Chris Hemsworth spends hours in the gym to get into Thor shape, but when he's off the clock, he relies on his family for a workout.</p>.Chris Hemsworth Shares His ""Ultimate Family Workout"" in Hilarious New Video"
61039a4aa12afb207a7377b7,"<p>Australian actor Chris Hemsworth recently turned to social media and showed off his workout skills as a veteran girl-dad and left fans in fits of laughter in the process. The actor showed off the secret exercise that keeps him looking toned and fit,</p>",Chris Hemsworth flexes girl-dad skills with ‘ultimate family workout’ guides,"<p>Australian actor Chris Hemsworth recently turned to social media and showed off his workout skills as a veteran girl-dad and left fans in fits of laughter in the process. The actor showed off the secret exercise that keeps him looking toned and fit,</p>.Chris Hemsworth flexes girl-dad skills with ‘ultimate family workout’ guides"
610399d7a12afb207a7377ac,"And now it looks like Hemsworth and his wife, actress Elsa Pataky, are getting their twin sons Tristan and Sasha involved in their training. In a pair of videos uploaded to his Instagram, Hemsworth boasted that he and Pataky have created the ""ultimate family workout.",Chris Hemsworth Just Designed the ‘Ultimate Family Workout’,"And now it looks like Hemsworth and his wife, actress Elsa Pataky, are getting their twin sons Tristan and Sasha involved in their training. In a pair of videos uploaded to his Instagram, Hemsworth boasted that he and Pataky have created the ""ultimate family workout..Chris Hemsworth Just Designed the ‘Ultimate Family Workout’"
