60b3bab5057f8512e43870c0,"<p>Double date! Chris Hemsworth and his wife Elsa Pataky looked loved-up as they stepped out for brunch in Sydney on Saturday Chris rugged up for the double date wearing a khaki jacket with the collar popped up,</p>",Chris Hemsworth and Elsa Pataky step out for breakfast in Sydney with the Thor star's parents,"<p>Double date! Chris Hemsworth and his wife Elsa Pataky looked loved-up as they stepped out for brunch in Sydney on Saturday Chris rugged up for the double date wearing a khaki jacket with the collar popped up,</p>.Chris Hemsworth and Elsa Pataky step out for breakfast in Sydney with the Thor star's parents"
60b3baad057f8512e43870bf,"<p>Chris Hemsworth and his wife Elsa Pataky stepped out for brunch in Sydney, on Saturday.The 37-year-old and his movie star wife, 44, were seen out for a stroll in the affluent suburb of Woollahra in Sydney's east.</p>",Chris Hemsworth and Elsa Pataky step out for breakfast in Sydney,"<p>Chris Hemsworth and his wife Elsa Pataky stepped out for brunch in Sydney, on Saturday.The 37-year-old and his movie star wife, 44, were seen out for a stroll in the affluent suburb of Woollahra in Sydney's east.</p>.Chris Hemsworth and Elsa Pataky step out for breakfast in Sydney"
60b49702057f8512e4387678,Actor Chris Hemsworth is reportedly considering running for office in Byron Bay after cutting his teeth in local politics by opposing a resort and tourism development at Seven Mile Beach.,Chris Hemsworth considering 'running for Mayor of Byron Shire one day',Actor Chris Hemsworth is reportedly considering running for office in Byron Bay after cutting his teeth in local politics by opposing a resort and tourism development at Seven Mile Beach..Chris Hemsworth considering 'running for Mayor of Byron Shire one day'
60b5f1b299dcc858544f2ea4,"After her divorce from Liam Hemsworth and a relationship with Kaitlynn Carter, Miley Cyrus seemed to settle down with Cody Simpson, though the two would only end up staying together for less than a year.","Cody Simpson Called His Relationship With Miley Cyrus ""Just One of Those Phases""","After her divorce from Liam Hemsworth and a relationship with Kaitlynn Carter, Miley Cyrus seemed to settle down with Cody Simpson, though the two would only end up staying together for less than a year..Cody Simpson Called His Relationship With Miley Cyrus ""Just One of Those Phases"""
60b60b1999dcc858544f30c5,"<p>Chris Hemsworth was all smiles as he boarded a private jet in Sydney on Sunday, as filming for Thor: Love and Thunder comes to an end.</p>",Chris Hemsworth and family board private jet after filming for Thor: Love and Thunder ends,"<p>Chris Hemsworth was all smiles as he boarded a private jet in Sydney on Sunday, as filming for Thor: Love and Thunder comes to an end.</p>.Chris Hemsworth and family board private jet after filming for Thor: Love and Thunder ends"
60b5fadc99dcc858544f2f94,Thor: Love and Thunder' has reportedly wrapped filming.  The Chris Hemsworth superhero film has been on a shooting spree since January in Australia. It is set to be the foruth film in the Thor franchise.,'Thor: Love and Thunder' wraps filming in Sydney: Reports,Thor: Love and Thunder' has reportedly wrapped filming.  The Chris Hemsworth superhero film has been on a shooting spree since January in Australia. It is set to be the foruth film in the Thor franchise..'Thor: Love and Thunder' wraps filming in Sydney: Reports
60b6115299dcc858544f3185,"Love and Thunder has reportedly finished filming in Sydney, Australia. The Taika Waititi-directed superhero film has a stellar cast including Chris Hemsworth (Thor), alongside Christian Bale (Gorr the God Butcher),",Marvel's 'Thor: Love and Thunder' filming reportedly wrapped in Australia,"Love and Thunder has reportedly finished filming in Sydney, Australia. The Taika Waititi-directed superhero film has a stellar cast including Chris Hemsworth (Thor), alongside Christian Bale (Gorr the God Butcher),.Marvel's 'Thor: Love and Thunder' filming reportedly wrapped in Australia"
60b6eb3f99dcc858544f324e,Love and Thunder has officially finished shooting according to Chris Hemsworth’s Instagram. The movie which reteamed the MCU actor with Oscar-winning,‘Thor: Love And Thunder’ Wraps As Chris Hemsworth Celebrates ‘National Don’t Flex Day’,Love and Thunder has officially finished shooting according to Chris Hemsworth’s Instagram. The movie which reteamed the MCU actor with Oscar-winning.‘Thor: Love And Thunder’ Wraps As Chris Hemsworth Celebrates ‘National Don’t Flex Day’
60b6ef1299dcc858544f32ab,"Thor Love And Thunder has officially finished filming, and Hemsworth has shared a behind the scenes picture. While 2020 may have thrown a proverbial banana peel on the MCU's Phase 4 track, things are quickly getting back up to speed.","Thor 4 Has Wrapped, Says Chris Hemsworth","Thor Love And Thunder has officially finished filming, and Hemsworth has shared a behind the scenes picture. While 2020 may have thrown a proverbial banana peel on the MCU's Phase 4 track, things are quickly getting back up to speed..Thor 4 Has Wrapped, Says Chris Hemsworth"
60b7034a99dcc858544f3431,Chris Hemsworth has posted a new Instagram photo to commemorate the end of filming on Marvel Studios' upcoming Thor sequel.,Marvel Wraps Production on Thor: Love and Thunder,Chris Hemsworth has posted a new Instagram photo to commemorate the end of filming on Marvel Studios' upcoming Thor sequel..Marvel Wraps Production on Thor: Love and Thunder
60b72e6a99dcc858544f351f,Aaron Carter has credited an unusual source of inspiration for getting through those dark times: Avengers star Chris Hemsworth.,Troubled star Aaron Carter credits Thor star Chris Hemsworth as his 'inspiration',Aaron Carter has credited an unusual source of inspiration for getting through those dark times: Avengers star Chris Hemsworth..Troubled star Aaron Carter credits Thor star Chris Hemsworth as his 'inspiration'
60b72ffd99dcc858544f3551,"Thor: Love and Thunder has wrapped shooting, with star Chris Hemsworth promising the Marvel film will be “bats... crazy”. Official press for the film, which opens in May next year, is still a little way off,","Taika Waititi, Chris Hemsworth, and some massive guns wrap shooting on 'crazy' Thor: Love and Thunder","Thor: Love and Thunder has wrapped shooting, with star Chris Hemsworth promising the Marvel film will be “bats... crazy”. Official press for the film, which opens in May next year, is still a little way off,.Taika Waititi, Chris Hemsworth, and some massive guns wrap shooting on 'crazy' Thor: Love and Thunder"
60b7364a99dcc858544f363d,"Love and Thunder, has officially wrapped production. The news was confirmed by the God of Thunder himself, as Thor actor Chris Hemsworth shared an Instagram post on Wednesday (June 2) to announce that the shoot was over while thanking Marvel,",Marvel's Chris Hemsworth confirms Thor: Love and Thunder has wrapped production,"Love and Thunder, has officially wrapped production. The news was confirmed by the God of Thunder himself, as Thor actor Chris Hemsworth shared an Instagram post on Wednesday (June 2) to announce that the shoot was over while thanking Marvel,.Marvel's Chris Hemsworth confirms Thor: Love and Thunder has wrapped production"
60b73bb999dcc858544f371b,"Love and Thunder”. Star Chris Hemsworth took to Twitter on June 1 to share a photo of himself and director Taika Waititi, both in costume. “That’s a wrap on ‘Thor Love and Thunder’, it’s also national don’t flex day so I thought this super relaxed photo was appropriate,","Chris Hemsworth Announces Production Has Wrapped On ‘Thor: Love And Thunder’, Promises ‘Bats**t Crazy’ Sequel","Love and Thunder”. Star Chris Hemsworth took to Twitter on June 1 to share a photo of himself and director Taika Waititi, both in costume. “That’s a wrap on ‘Thor Love and Thunder’, it’s also national don’t flex day so I thought this super relaxed photo was appropriate,.Chris Hemsworth Announces Production Has Wrapped On ‘Thor: Love And Thunder’, Promises ‘Bats**t Crazy’ Sequel"
60b73bc199dcc858544f371d,Thor: Love and Thunder's Chris Hemsworth has shared the exciting news that the upcoming MCU movie has finished filming alongside an image of him looking absolutely ripped.,Chris Hemsworth Is Looking Absolutely Ripped As Thor: Love and Thunder Wraps Filming,Thor: Love and Thunder's Chris Hemsworth has shared the exciting news that the upcoming MCU movie has finished filming alongside an image of him looking absolutely ripped..Chris Hemsworth Is Looking Absolutely Ripped As Thor: Love and Thunder Wraps Filming
60b73bbd99dcc858544f371c,"In the caption, Hemsworth made some bold promises. “The film is gonna be bats*it crazy off the wall funny and might also pull a heart string or two,” he wrote. He tacked on a couldn’t-resist addition,",Chris Hemsworth Celebrated The End Of The ‘Thor: Love And Thunder’ Shoot By Promising It Will Be ‘Bats*it Crazy’,"In the caption, Hemsworth made some bold promises. “The film is gonna be bats*it crazy off the wall funny and might also pull a heart string or two,” he wrote. He tacked on a couldn’t-resist addition,.Chris Hemsworth Celebrated The End Of The ‘Thor: Love And Thunder’ Shoot By Promising It Will Be ‘Bats*it Crazy’"
60b73bcb99dcc858544f371f,Love and Thunder has been wrapped up. Chris Hemsworth and Taika Waititi announced the same with a BTS picture from the film's set.,"Chris Hemsworth announces Thor Love and Thunder wrap, shares BTS pic with Taika Waititi","Love and Thunder has been wrapped up. Chris Hemsworth and Taika Waititi announced the same with a BTS picture from the film's set..Chris Hemsworth announces Thor Love and Thunder wrap, shares BTS pic with Taika Waititi"
60b73bc499dcc858544f371e,Chris Hemsworth shared a behind-the-scenes fun picture from the sets of the latest Thor film and wrote a tribute to the film on the occasion of wrapping it up.,Chris Hemsworth Wraps 'Thor: Love And Thunder'; Shares BTS Picture With A Heartfelt Note,Chris Hemsworth shared a behind-the-scenes fun picture from the sets of the latest Thor film and wrote a tribute to the film on the occasion of wrapping it up..Chris Hemsworth Wraps 'Thor: Love And Thunder'; Shares BTS Picture With A Heartfelt Note
60b839ed99dcc858544f3ac1,A photo of Chris Hemsworth apparently set off this latest debate on the unrealistic body standards male action stars are held to.,‘This makes me sad’: Chris Hemsworth’s jacked arms spark debate on body standards for male action stars,A photo of Chris Hemsworth apparently set off this latest debate on the unrealistic body standards male action stars are held to..‘This makes me sad’: Chris Hemsworth’s jacked arms spark debate on body standards for male action stars
60b8458199dcc858544f3b4f,Actor Chris Hemsworth and Director Taika Waititi share a behind the scene image of themselves together while wrapping up the,THOR: LOVE & THUNDER-Taika Waititi & Chris Hemsworth Wrap Up The Marvel Movie,Actor Chris Hemsworth and Director Taika Waititi share a behind the scene image of themselves together while wrapping up the.THOR: LOVE & THUNDER-Taika Waititi & Chris Hemsworth Wrap Up The Marvel Movie
60b861e999dcc858544f3d91,"Chris Hemsworth shares BTS photo with filmmaker Taika Waititi, announces film's wrap - Director Waititi too announced that he had wrapped shooting of the film while revealing a few details of the much-awaited flick on his Instagram.","'Thor: Love and Thunder': Chris Hemsworth shares BTS photo with filmmaker Taika Waititi, announces film's wrap","Chris Hemsworth shares BTS photo with filmmaker Taika Waititi, announces film's wrap - Director Waititi too announced that he had wrapped shooting of the film while revealing a few details of the much-awaited flick on his Instagram..'Thor: Love and Thunder': Chris Hemsworth shares BTS photo with filmmaker Taika Waititi, announces film's wrap"
60b8829499dcc858544f3e12,"""That's a wrap on Thor Love and Thunder, it's also national don't flex day so I thought this super relaxed photo was appropriate,"" Hemsworth wrote alongside a photo of his with Waititi on Instagram. ""The film is gonna be bats*** crazy off the wall funny and might also pull a heart string or two.",Why are Chris Hemsworth fans commenting on the ‘Thor’ actor’s arm in latest picture?,"""That's a wrap on Thor Love and Thunder, it's also national don't flex day so I thought this super relaxed photo was appropriate,"" Hemsworth wrote alongside a photo of his with Waititi on Instagram. ""The film is gonna be bats*** crazy off the wall funny and might also pull a heart string or two..Why are Chris Hemsworth fans commenting on the ‘Thor’ actor’s arm in latest picture?"
60b8951399dcc858544f409a,"Love and Thunder wrapping production, Hanton’s claim that the Thor star is the biggest he’s ever been is looking like the gospel truth. Just check out those arms. Last week, Hemsworth shared a photo of himself taking his son for a walk,",Chris Hemsworth Shared His Most Ridiculously Jacked Photo Yet From The Set Of ‘Thor: Love And Thunder’,"Love and Thunder wrapping production, Hanton’s claim that the Thor star is the biggest he’s ever been is looking like the gospel truth. Just check out those arms. Last week, Hemsworth shared a photo of himself taking his son for a walk,.Chris Hemsworth Shared His Most Ridiculously Jacked Photo Yet From The Set Of ‘Thor: Love And Thunder’"
60b8951399dcc858544f4097,Chris Hemsworth looks more like the Hulk than the God of Thunder. The actor recently celebrated the wrapping of filming for Thor: Love & Thunder with a new pic that has fans buzzing on Thor’s incredible shape.,Chris Hemsworth wraps Thor: Love & Thunder filming showing off his amazing physique,Chris Hemsworth looks more like the Hulk than the God of Thunder. The actor recently celebrated the wrapping of filming for Thor: Love & Thunder with a new pic that has fans buzzing on Thor’s incredible shape..Chris Hemsworth wraps Thor: Love & Thunder filming showing off his amazing physique
60b8951399dcc858544f4096,"Thor actor Chris Hemsworth's arms are causing a meltdown on social media. In an Instagram post on Wednesday (June 2), he announced that Thor: Love And Thunder had wrapped, but all anyone cared to comment on was his jack-up arms.",Chris Hemsworth's arms send Internet into a tizzy as he wraps latest Thor film,"Thor actor Chris Hemsworth's arms are causing a meltdown on social media. In an Instagram post on Wednesday (June 2), he announced that Thor: Love And Thunder had wrapped, but all anyone cared to comment on was his jack-up arms..Chris Hemsworth's arms send Internet into a tizzy as he wraps latest Thor film"
60b8951399dcc858544f409b,"Chris Hemsworth is celebrating two special occasions -- wrapping Thor: Love and Thunder, and National Don't Flex Day! The 37-year-old actor took to Instagram on Tuesday, sharing a black-and-white snap of him and Taika Waititi on set of the upcoming Disney/Marvel film.",Chris Hemsworth Celebrates Wrapping 'Thor: Love and Thunder' With 'Super Relaxed' Biceps Pic,"Chris Hemsworth is celebrating two special occasions -- wrapping Thor: Love and Thunder, and National Don't Flex Day! The 37-year-old actor took to Instagram on Tuesday, sharing a black-and-white snap of him and Taika Waititi on set of the upcoming Disney/Marvel film..Chris Hemsworth Celebrates Wrapping 'Thor: Love and Thunder' With 'Super Relaxed' Biceps Pic"
60b8951399dcc858544f4098,Love and Thunder” shows actor Chris Hemsworth looking jacked up and swole. “Thor: Love and Thunder” director Taika Waititi shared a photo of himself and Hemsworth that confirmed the movie had wrapped up filming.,Chris Hemsworth is jacked,Love and Thunder” shows actor Chris Hemsworth looking jacked up and swole. “Thor: Love and Thunder” director Taika Waititi shared a photo of himself and Hemsworth that confirmed the movie had wrapped up filming..Chris Hemsworth is jacked
60b89f5899dcc858544f416d,Love and Thunder has officially finished shooting according to Chris Hemsworth’s Instagram. The movie which reteamed the MCU actor with Oscar-winning,‘Thor: Love And Thunder’ Wraps As Chris Hemsworth Celebrates ‘National Don’t Flex Day’,Love and Thunder has officially finished shooting according to Chris Hemsworth’s Instagram. The movie which reteamed the MCU actor with Oscar-winning.‘Thor: Love And Thunder’ Wraps As Chris Hemsworth Celebrates ‘National Don’t Flex Day’
60b8a1b399dcc858544f419c,Love and Thunder and Hollywood star Chris Hemsworth on Wednesday promised fans that the upcoming movie w..|News Track,"Chris Hemsworth wraps Thor: Love and Thunder shoot, says film will be 'crazy off the wall funny'","Love and Thunder and Hollywood star Chris Hemsworth on Wednesday promised fans that the upcoming movie w..|News Track.Chris Hemsworth wraps Thor: Love and Thunder shoot, says film will be 'crazy off the wall funny'"
60b8a72999dcc858544f4250,Love and Thunder and Hollywood star Chris Hemsworth on Wednesday promised fans that the upcoming movie will be crazy off the wall funny.,"Thor: Love and Thunder Wraps Up Production, Chris Hemsworth Says 'See Ya In Cinemas'","Love and Thunder and Hollywood star Chris Hemsworth on Wednesday promised fans that the upcoming movie will be crazy off the wall funny..Thor: Love and Thunder Wraps Up Production, Chris Hemsworth Says 'See Ya In Cinemas'"
60b8a72999dcc858544f4251,"From new shows to new superheroes, Marvel has been making sure to treat us to a steady stream of amazing content. But the 'God' of capturing the internet's attention seems to be Thor himself, aka Chris Hemsworth.",Thor Or Hulk?: Internet Cannot Get Over Chris Hemsworth’s ‘Thunderous’ New Look,"From new shows to new superheroes, Marvel has been making sure to treat us to a steady stream of amazing content. But the 'God' of capturing the internet's attention seems to be Thor himself, aka Chris Hemsworth..Thor Or Hulk?: Internet Cannot Get Over Chris Hemsworth’s ‘Thunderous’ New Look"
60b9b2f499dcc858544f479c,Chris Hemsworth’s physique is a subject of fascination at the best of times but new photos of the Hollywood heartthrob have invited more than just lustful longings. A snap of the 37-year old stood beside Thor: Love and Thunder director Taika Waititi has sparked a widespread debate about the almost inhuman body standards to which male action stars are held.,Chris Hemsworth’s uber-jacked arms spark debate about male body standards,Chris Hemsworth’s physique is a subject of fascination at the best of times but new photos of the Hollywood heartthrob have invited more than just lustful longings. A snap of the 37-year old stood beside Thor: Love and Thunder director Taika Waititi has sparked a widespread debate about the almost inhuman body standards to which male action stars are held..Chris Hemsworth’s uber-jacked arms spark debate about male body standards
60b9d72e99dcc858544f4928,"Chris Hemsworth took to Instagram this week to post a photo of himself alongside director Taika Waititias the two finished filming the upcoming Marvel Cinematic Universe film Thor: Love and Thunder. After his character let himself go in Avengers: Endgame,",Hulk Hogan Praises Chris Hemsworth's Physique in Thor: Love and Thunder Photo,"Chris Hemsworth took to Instagram this week to post a photo of himself alongside director Taika Waititias the two finished filming the upcoming Marvel Cinematic Universe film Thor: Love and Thunder. After his character let himself go in Avengers: Endgame,.Hulk Hogan Praises Chris Hemsworth's Physique in Thor: Love and Thunder Photo"
60b9d72e99dcc858544f4927,"As Chris Hemsworth reportedly keeps packing on muscle to play wrestling legend Hulk Hogan in an upcoming biopic, he also continues to receive praise from the man himself for the authenticity of his God-like gains.",Hulk Hogan Reacts to Chris Hemsworth’s Massive Arms in ‘Thor 4’ Photo,"As Chris Hemsworth reportedly keeps packing on muscle to play wrestling legend Hulk Hogan in an upcoming biopic, he also continues to receive praise from the man himself for the authenticity of his God-like gains..Hulk Hogan Reacts to Chris Hemsworth’s Massive Arms in ‘Thor 4’ Photo"
60b9dd5999dcc858544f4a20,"The internet cannot stop talking about Chris Hemsworth aka Thor’s arms and his latest picture went viral in a jiff. On Tuesday, Thor: Love and Thunder filmmaker Taika Waititi shared a photo of himself and Hemsworth to Instagram confirming that filming had wrapped on Marvel’s fourth Thor film.",Thor’s Latest Pic Going Viral,"The internet cannot stop talking about Chris Hemsworth aka Thor’s arms and his latest picture went viral in a jiff. On Tuesday, Thor: Love and Thunder filmmaker Taika Waititi shared a photo of himself and Hemsworth to Instagram confirming that filming had wrapped on Marvel’s fourth Thor film..Thor’s Latest Pic Going Viral"
60bb1b1799dcc858544f4e39,"Sharks are no match for Thor. This year’s Sharkfest on National Geographic is set to include the one-hour special “Shark Beach with Chris Hemsworth”, hosted by the Marvel star. RELATED: Hulk Hogan Compliments Chris Hemsworth’s ‘Hogan Pump’ As ‘Thor’ Star Bulks Up To Play Wrestling Icon In Biopic In the special,",Chris Hemsworth Goes Swimming With Sharks In New National Geographic Special,"Sharks are no match for Thor. This year’s Sharkfest on National Geographic is set to include the one-hour special “Shark Beach with Chris Hemsworth”, hosted by the Marvel star. RELATED: Hulk Hogan Compliments Chris Hemsworth’s ‘Hogan Pump’ As ‘Thor’ Star Bulks Up To Play Wrestling Icon In Biopic In the special,.Chris Hemsworth Goes Swimming With Sharks In New National Geographic Special"
60bb1b1799dcc858544f4e3a,"Love and Thunder, Marvel fans won’t get to see the long-awaited fourth installment in the Thor film series until 2022. Thankfully Thor actor Chris Hemsworth has decided to keep busy with other things in the meantime.",Chris Hemsworth Trades in Stormbreaker for a Wetsuit In Nat Geo’s SharkFest,"Love and Thunder, Marvel fans won’t get to see the long-awaited fourth installment in the Thor film series until 2022. Thankfully Thor actor Chris Hemsworth has decided to keep busy with other things in the meantime..Chris Hemsworth Trades in Stormbreaker for a Wetsuit In Nat Geo’s SharkFest"
60bb308299dcc858544f4f6a,"Chris Hemsworth has been receiving massive applause from fans and friends since he posted a picture of himself, showing off his biceps and incredible physique. The dashing actor has attracted all the fan praise.",Hulk Hogan is super impressed with Chris Hemsworth’s biceps,"Chris Hemsworth has been receiving massive applause from fans and friends since he posted a picture of himself, showing off his biceps and incredible physique. The dashing actor has attracted all the fan praise..Hulk Hogan is super impressed with Chris Hemsworth’s biceps"
60bb39fc99dcc858544f5099,"Sharkfest is around the corner at National Geographic, and the ninth annual event has quite the TV lineup. Kicking off Monday, July 5, the programming slate will begin with an episode of When Sharks Attack followed by the marquee special Shark Beach with Chris Hemsworth.",Nat Geo’s SharkFest 2021: Chris Hemsworth’s ‘Shark Beach’ & More Make the Lineup (VIDEO),"Sharkfest is around the corner at National Geographic, and the ninth annual event has quite the TV lineup. Kicking off Monday, July 5, the programming slate will begin with an episode of When Sharks Attack followed by the marquee special Shark Beach with Chris Hemsworth..Nat Geo’s SharkFest 2021: Chris Hemsworth’s ‘Shark Beach’ & More Make the Lineup (VIDEO)"
60bb9eef99dcc858544f5351,Hulk Hogan is impressed with actor Chris Hemsworth's physical transformation to portray The Hulkster in the upcoming Netflix biopic.,Photo: Hulk Hogan Stunned By Chris Hemsworth’s Physique Ahead Of Netflix Biopic,Hulk Hogan is impressed with actor Chris Hemsworth's physical transformation to portray The Hulkster in the upcoming Netflix biopic..Photo: Hulk Hogan Stunned By Chris Hemsworth’s Physique Ahead Of Netflix Biopic
60bc963899dcc858544f5837,"Chris Hemsworth, Hugh Jackman and Margot Robbie have done it and now Bachelor couple Anna Heinrich and Tim Robards have joined the ranks of people getting that all important Quokka Selfie.",Bachelor couple Anna Heinrich and Tim Robards pose for quokka selfie on Rottnest Island,"Chris Hemsworth, Hugh Jackman and Margot Robbie have done it and now Bachelor couple Anna Heinrich and Tim Robards have joined the ranks of people getting that all important Quokka Selfie..Bachelor couple Anna Heinrich and Tim Robards pose for quokka selfie on Rottnest Island"
60bc963899dcc858544f5836,"Chris Hemsworth, Hugh Jackman and Margot Robbie have done it and now Bachelor couple Anna Heinrich and Tim Robards have joined the ranks of people getting that all important Quokka Selfie.",Bachelor couple Anna Heinrich and Tim Robards pose for quokka selfie on Rottnest Island,"Chris Hemsworth, Hugh Jackman and Margot Robbie have done it and now Bachelor couple Anna Heinrich and Tim Robards have joined the ranks of people getting that all important Quokka Selfie..Bachelor couple Anna Heinrich and Tim Robards pose for quokka selfie on Rottnest Island"
